titleRestaurant,adress,information,kitchens,number_of_comments,phoneNumber,price,score,special_types_of_diets,average_price,price_min
Havuzlu Restoran,"No. 3 Kapalicarsi Caddesi Inside the Grand Bazaar, İstanbul Türkiye,İnternet sitesi","Türk,Ortadoğu,Vejetaryen Dostu","Vejetaryen Dostu, Vegan Seçenekleri, Helal",256,5273346,,4.0,"Öğle Yemeği, Akşam Yemeği",39.0,39.0
Aquarius,"Cami Arkası Sokak No: 11 Sarıyer, İstanbul Türkiye,İnternet sitesi,Menü","Deniz Mahsülleri,Türk","Akşam Yemeği, Öğle Yemeği",103,+90 212 271 34 34,,4.0,"Rezervasyonlar, Açık Havada Oturma, Oturma, Tekerlekli Sandalye İle Erişim, Masaya Servis",37.5,37.5
Pasa Kokorec ve İskembe Salonu,"Çengelköy Caddesi No: 53, İstanbul Türkiye,İnternet sitesi",Türk,Akşam Yemeği,76,+90 216 318 12 80,,4.0,Dışarı Yemek Servisi,37.5,37.5
Kırçiçeği,"Muallim Naci Caddesi No:41 Ortaköy, Beşiktaş, İstanbul Türkiye,İnternet sitesi","Fast Food,Türk,Lokanta",Helal,69,+90 212 260 35 35,,4.0,"Öğle Yemeği, Akşam Yemeği",37.5,37.5
Snob Street Food,"Caddebostan Mah. Bağdat Cad. No: 292 Kadıköy, İstanbul 34728 Türkiye,İnternet sitesi,Menü","Sağlıklı,Sokak Yemekleri","Sokak Yemekleri, Sağlıklı",42,+90 216 359 79 99,30-45,4.0,"Öğle Yemeği, Akşam Yemeği",37.5,37.5
Paşalı Kebap & Pide,"Çengelköy Cad. No: 54 Üsküdar, İstanbul 34680 Türkiye,İnternet sitesi","Türk,Şarküteri,Çorbalar","Türk, Şarküteri, Çorbalar",42,+90 216 422 90 00,15-60,4.0,"Öğle Yemeği, İçecekler, Kahvaltı, Akşam Yemeği",37.5,37.5
Bursa Garaj Kebap,"Levent Mahallesi, Çamlık Caddesi, Hanımeli Sokak No: 2 Beşiktaş, İstanbul Türkiye,İnternet sitesi,Menü","Akdeniz,Türk,Helal",Helal,33,+90 212 281 48 48,,4.0,"Kahvaltı, Öğle Yemeği, Akşam Yemeği",37.5,37.5
Kalyon Restaurant,"Kennedy Caddesi Sahilyolu 34 Sultanahmet, İstanbul 34122 Türkiye,İnternet sitesi","İtalyan,Deniz Mahsülleri,Uluslararası","Kahvaltı, Öğle Yemeği, Akşam Yemeği",31,+90 212 517 46 81,,4.0,"Rezervasyonlar, Açık Havada Oturma, Alkol Var, Oturma, Masaya Servis",37.5,37.5
Donerist,"Yildizposta cad. Esentepe mah. 23/10 Gayrettepe Sisli, İstanbul 34333 Türkiye,İnternet sitesi,Menü","Fast Food,Türk,Helal",Helal,31,+90 212 213 02 14,,4.0,"Kahvaltı, Öğle Yemeği, Akşam Yemeği",37.5,37.5
Snob Street Food,"Caferağa Mah, Doktor Esat Işık Cad. No: 50 A/B Kadıköy, İstanbul 34710 Türkiye,İnternet sitesi,Menü",Fast Food,Fast Food,14,+90 216 336 76 62,25-50,4.0,"Öğle Yemeği, Akşam Yemeği, Brunch, İçecekler",37.5,37.5
Pizza House Kadıköy,"Müdürdar Caddesi Kadıköy, İstanbul Türkiye,İnternet sitesi,Menü",Pizza,Pizza,17,+90 850 749 9224,21-50,4.0,"Kahvaltı, Öğle Yemeği, Akşam Yemeği",35.5,35.5
Bolpi,"Fulya Mahallesi, Mehmetçik Caddesi No: 4/A Şişli, Mecidiyeköy, Avrupa Hastanesi Karşısı, İstanbul 34394 Türkiye,İnternet sitesi,Menü",Türk,Türk,5,+90 212 211 19 00,21-50,4.0,"İçecekler, Öğle Yemeği, Akşam Yemeği",35.5,35.5
Pedro Istanbul,"Caferaga Mh. Ferit Tek Sok. No:21b, İstanbul Türkiye,İnternet sitesi","Meksika,Amerikan,Akdeniz","Meksika, Amerikan, Akdeniz, Avrupa, Türk",7,+90 216 418 04 67,20-50,4.0,"Öğle Yemeği, Akşam Yemeği, Brunch",35.0,35.0
Anas Chicken Aksaray 2nd branch,"Turgut Özal Millet Cd No:4/3 Yusufpaşa tramvay istasyonu yanında, İstanbul 34093 Türkiye,İnternet sitesi,Menü","Fast Food,Arap","Fast Food, Arap",18,+90 551 044 44 44,6-63,4.0,"Öğle Yemeği, Akşam Yemeği, Brunch, Gece Eğlencesi",34.5,34.5
Porta Pera,"İstiklal Cad. No:11 Taksim, İstanbul Türkiye,İnternet sitesi",İtalyan,"Kahvaltı, Öğle Yemeği, Akşam Yemeği",13,2444467,,4.0,"Masaya Servis, Rezervasyonlar, Oturma",34.0,34.0
Avlu Ocakbaşı,"Yeni Çarşı Caddesi No: 32 Firuzaga Mahallesi, İstanbul 34430 Türkiye,İnternet sitesi,Menü","Türk,Helal",Türk,225,+90 546 233 44 51,12-54,4.0,Helal,33.0,33.0
Merkezefendi Koftecisi Rahmi Usta 1962,"Merkezefendi Mahallesi, Merkezefendi Caddesi, Hamam Çıkmazı Sokak No: 1 Zeytinburnu, İstanbul 34000 Türkiye,İnternet sitesi","Türk,Helal",Türk,64,+90 212 546 76 80,16-50,4.0,Helal,33.0,33.0
Sait Iskender Laleli,"Aksaray Cad. No:13 D:15 Laleli, Fatih, İstanbul Türkiye,İnternet sitesi,Menü","Barbekü,Türk,Mangal","Barbekü, Türk, Mangal, Çağdaş, Rus",210,+90 212 518 54 86,15-50,4.0,"Öğle Yemeği, Akşam Yemeği, Kahvaltı, Brunch, İçecekler",32.5,32.5
70'lik Meyhane,"Atatürk Cad. No: 6/B Küçük Armutlu, İstanbul 34470 Türkiye,İnternet sitesi",Türk,"Akşam Yemeği, Öğle Yemeği",71,+90 212 277 66 12,,4.0,Rezervasyonlar,32.5,32.5
The House Cafe Corner,"Tesvikiye Caddesi No.146 Tesvikiye, İstanbul 34365 Türkiye,İnternet sitesi,Menü",Kafe,"Öğle Yemeği, Brunch, Kahvaltı, Akşam Yemeği",54,+90 444 4 842,,4.0,"Açık Havada Oturma, Oturma, Masaya Servis",32.5,32.5
Her Alem Ocakbaşı,"Esentepe Mah. Oya Sk. No: 2/A, İstanbul 34394 Türkiye,İnternet sitesi,Menü",Türk,"Öğle Yemeği, Akşam Yemeği",22,+90 212 211 03 04,,4.0,"Rezervasyonlar, Masaya Servis",32.5,32.5
Grup Saray Restaurant,"Binbirdirek Mahallesi, Sehit Mehmet Pasa Yokusu, No:4-6, İstanbul 34122 Türkiye,İnternet sitesi","Kafe,Deniz Mahsülleri,Türk","Kafe, Deniz Mahsülleri, Türk",21,+90 212 517 47 00,10-55,4.0,Helal,32.5,32.5
Kafka Cafe,"Tomtom Mah. Yenicarsi Cad. No:26/1 Galatasaray, İstanbul Türkiye,İnternet sitesi","Kafe,Uluslararası","Kahvaltı, Öğle Yemeği, Akşam Yemeği",20,+90 212 245 19 58,,4.0,"Oturma, Masaya Servis",32.5,32.5
Bankalar Lokantası,"Arap Cami Mahallesi, Perşembe Pazarı Cd. No: 5 Beyoğlu, Karaköy, İstanbul 34421 Türkiye,İnternet sitesi",Türk,Öğle Yemeği,18,+90 212 245 09 49,,4.0,Rezervasyonlar,32.5,32.5
All Eatalian,"Bahçeşehir 1. Kısım Mahallesi, Kemal Sunal Caddesi Bahçeşehir QNB Finansbank Yanı, İstanbul 34488 Türkiye,İnternet sitesi,Menü","İtalyan,Pizza,Akdeniz","İtalyan, Pizza, Akdeniz, Çorbalar",18,+90 212 450 40 50,10-55,4.0,"Öğle Yemeği, Akşam Yemeği, Kahvaltı, Brunch, İçecekler",32.5,32.5
Burgerhood,"Teşvikiye Mahallesi, Hacı Emin Efendi Sok. No: 24/E Şişli, İstanbul 34365 Türkiye,İnternet sitesi,Menü",Amerikan,Amerikan,17,+90 212 234 63 03,15-50,4.0,"Öğle Yemeği, Akşam Yemeği",32.5,32.5
Sadrazam Mahmut,"Kumbarhane Cad. No:64 HalIcIoglu, İstanbul Türkiye,İnternet sitesi,Menü",Türk,Akşam Yemeği,17,3695684,,4.0,Rezervasyonlar,32.5,32.5
Pizza Zer0,"5.cadde 3/B Zekeriyakoy Mahallesi, İstanbul 34450 Türkiye,İnternet sitesi,Menü","İtalyan,Pizza,Deniz Mahsülleri","İtalyan, Pizza, Deniz Mahsülleri, Şarküteri, Sağlıklı",5,+90 212 202 77 77,5-60,4.0,"Öğle Yemeği, Akşam Yemeği, İçecekler",32.5,32.5
Balkanika Restoran,"Mimar Sinan Cad. No:34 Yeni Mahalle Mah., İstanbul 34893 Türkiye,İnternet sitesi","Avrupa,Türk,Arnavut","Avrupa, Türk, Arnavut",5,+90 216 491 90 52,20-45,4.0,"Öğle Yemeği, Akşam Yemeği, Gece Eğlencesi, İçecekler",32.5,32.5
Core Grill,"Ataşehir Mahallesi, Yakut Caddesi No: 10 Radisson Blu, İstanbul Türkiye,İnternet sitesi",Türk,Akşam Yemeği,3,+90 216 579 11 00,,4.0,Rezervasyonlar,32.5,32.5
Litera,"Yeni Çarşı Cad. No.32 Beyoğlu, İstanbul Türkiye,İnternet sitesi,Menü","Uluslararası,Avrupa,Türk",Vegan Seçenekleri,1198,+90 212 292 89 47,,4.0,"Öğle Yemeği, Akşam Yemeği, Gece Eğlencesi",32.0,32.0
Paps Italian,"Kemankeş Mahallesi Fransız Geçidi Sokak A Blok No:4, Beyoğlu, İstanbul 34425 Türkiye,İnternet sitesi","İtalyan,Pizza,Akdeniz","Vejetaryen Dostu, Vegan Seçenekleri",1177,+90 212 243 98 48,,4.0,"Öğle Yemeği, Akşam Yemeği",32.0,32.0
Baldır Sirkeci,"Hobyar Mah. Aşir Efendi Caddesi, İmar Han No: 15/A Sirkeci Büyük Postane Arka Caddesi  Hobyar Cami Karşısında, İstanbul 34112 Türkiye,İnternet sitesi","Türk,Helal",Türk,535,+90 212 522 25 37,20-44,4.0,Helal,32.0,32.0
Del Mare,"Küleli Caddesi No:53 / 4 Çengelköy, İstanbul Türkiye,İnternet sitesi,Menü","Deniz Mahsülleri,Akdeniz,Avrupa",Vejetaryen Dostu,497,+90 216 422 57 62,,4.0,"Öğle Yemeği, Akşam Yemeği, Gece Eğlencesi",32.0,32.0
Ciğeristan,"Sofular Mah. Horhor Cad. Simitçi Şakir Sok. No:16 Fatih, Aksaray Metro İstasyonu, A Kapısı Yanında, İstanbul 34083 Türkiye,İnternet sitesi,Menü","Barbekü,Türk,Helal",Helal,471,+90 534 057 51 51,,4.0,"Öğle Yemeği, Akşam Yemeği, Gece Eğlencesi",32.0,32.0
Mavi Melek,"Asmalimescit Mah. Asmalimescit Sok. No:23/A, İstanbul 34430 Türkiye,İnternet sitesi","Akdeniz,Türk,Vejetaryen Dostu",Vejetaryen Dostu,134,+90 212 245 69 58,,4.0,"Öğle Yemeği, Akşam Yemeği, İçecekler, Gece Eğlencesi",32.0,32.0
Sefa Restaurant,"Nuruosmaniye Cad. No:17 Eminonu Cagaloglu, İstanbul Türkiye,İnternet sitesi,Menü","Türk,Helal",Helal,116,+90 212 520 06 70,,4.0,Öğle Yemeği,32.0,32.0
Paul's Lasagna,"Caferağa Mahallesi, Dr. Esat Işık Caddesi No: 53/A Moda, Saint Joseph Karşısı, İstanbul Türkiye,İnternet sitesi",İtalyan,İtalyan,106,+90 216 330 19 82,19-45,4.0,Masaya Servis,32.0,32.0
Terrace Restaurant,"Divan Yolu Cad. Hotel Sultanahmet No:20 Fatih Sultanahmet, İstanbul Türkiye,İnternet sitesi",Türk,"Öğle Yemeği, Akşam Yemeği",35,5270239,,4.0,"Oturma, Rezervasyonlar, Masaya Servis",32.0,32.0
Beylerbeyi Doğa Restaurant,"Beylerbeyi Mahallesi, Yalıboyu Caddesi No: 36, İstanbul Türkiye,İnternet sitesi,Menü",Deniz Mahsülleri,Akşam Yemeği,35,+90 216 422 28 51,,4.0,"Rezervasyonlar, Tekerlekli Sandalye İle Erişim",32.0,32.0
Cachi Lokanta Bar,"Asmalı Mescit Mah. General Yazgan Sokağı No: 14 Beyoğlu, Adahan İstanbul Otel, İstanbul 34430 Türkiye,İnternet sitesi","Avrupa,Türk,Vegan Seçenekleri",Vegan Seçenekleri,27,+90 212 243 85 81,,4.0,"Kahvaltı, Akşam Yemeği, Öğle Yemeği, Brunch",32.0,32.0
Daphne Restaurant & Grill,"Yesilyurt Mah. Sahil Yolu Cad. Polat Renaissance Hotel No:2 Yesilkoy, Bakirkoy, İstanbul Türkiye,İnternet sitesi","Akdeniz,Türk","Kahvaltı, Öğle Yemeği, Akşam Yemeği, Brunch",25,4141800,,4.0,"Rezervasyonlar, Tekerlekli Sandalye İle Erişim, Masaya Servis",32.0,32.0
Ayazma Restaurant,"Hacı Kasım Mahallesi, Küçük Mendirek Plaj Yolu No:1 Şile, İstanbul 34980 Türkiye,İnternet sitesi",Deniz Mahsülleri,Akşam Yemeği,20,+90 216 712 12 95,,4.0,Rezervasyonlar,32.0,32.0
Kebabi,"Yıldız Posta Cd no 44 - 2 Beşiktaş, İstanbul 34340 Türkiye,İnternet sitesi,Menü","Türk,Helal",Türk,528,+90 212 275 35 22,23-40,4.0,Helal,31.5,31.5
Borsa Restaurant,"Harbiye Mahallesi, Gümüş Cad. No: 4 Şişli, İstanbul 80230 Türkiye,İnternet sitesi,Menü","Akdeniz,Avrupa,Türk","Helal, Vejetaryen Dostu",107,+90 212 232 42 01,,4.0,"Öğle Yemeği, Akşam Yemeği, Gece Eğlencesi",31.5,31.5
Baydöner,"Kuloğlu Mahallesi, İstiklal Caddesi No: 143 Beyoğlu, İstanbul Türkiye,İnternet sitesi","Türk,Helal",Helal,29,+90 212 293 28 88,,4.0,"Akşam Yemeği, Öğle Yemeği, Brunch",31.5,31.5
Musafir Indian Restaurant Since 2004,"Talimhane Recep Paşa Cad. No:7/C Taksim, İstanbul 34437 Türkiye,İnternet sitesi,Menü","Hint,Asya,Arap","Hint, Asya, Arap",341,+90 212 235 27 41,14-48,4.0,"Vejetaryen Dostu, Vegan Seçenekleri, Helal",31.0,31.0
Pera Thai,"Meşrutiyet Caddesi, 94 A Şişhane - Beyoğlu, İstanbul Türkiye,İnternet sitesi,Menü","Asya,Tayland,Vejetaryen Dostu","Asya, Tayland",2444,+90 212 245 57 25,20-40,4.0,"Vejetaryen Dostu, Vegan Seçenekleri, Glütensiz Seçenekler",30.0,30.0
Reina,"Ortaköy Mahallesi, Muallim Naci Cd No:44, İstanbul 34347 Türkiye,İnternet sitesi,Menü","Deniz Mahsülleri,Akdeniz,Avrupa","Akşam Yemeği, Gece Eğlencesi, İçecekler",1109,+90 212 259 59 19,,4.0,"Rezervasyonlar, Açık Havada Oturma, Oturma, Otopark Var, İndirimli Park Hizmeti, Vale Otopark, Alkol Var, Tüm İçkiler, Ücretsiz Wifi, Masaya Servis",30.0,30.0
The House Cafe Ortaköy,"Salhane Sok. No:1 Ortaköy, Beşiktaş, İstanbul Türkiye,İnternet sitesi,Menü","Kafe,Uluslararası,Akdeniz","Vejetaryen Dostu, Vegan Seçenekleri, Glütensiz Seçenekler",758,+90 444 4 842,,4.0,"Kahvaltı, Öğle Yemeği, Akşam Yemeği, Brunch, Gece Eğlencesi, İçecekler",30.0,30.0
Balık Ekmek,"Ataköy 2-5-6. Mahallesi D: 32 Bakırköy, 5. Kısım Çarşısı, İstanbul Türkiye,İnternet sitesi","Deniz Mahsülleri,Fast Food,Türk","Öğle Yemeği, Gece Eğlencesi",678,+90 212 559 74 00,,4.0,"Paket Yemek, Açık Havada Oturma, Oturma, Tekerlekli Sandalye İle Erişim",30.0,30.0
Çiya,"Caferağa Mah. Güneşlibahçe Sk. No: 48/B Kadıköy, İstanbul 34710 Türkiye,İnternet sitesi,Menü","Türk,Ortadoğu,Vejetaryen Dostu","Helal, Vejetaryen Dostu",160,+90 216 336 30 13,,4.0,"Öğle Yemeği, Akşam Yemeği, Gece Eğlencesi",30.0,30.0
Keyif Nevizade,"Nevizade Sokak, 10, Beyoğlu Balikpazari, İstanbul 34440 Türkiye,İnternet sitesi,Menü","Deniz Mahsülleri,Türk","Deniz Mahsülleri, Türk",77,+90 212 252 58 19,20-40,4.0,"Akşam Yemeği, İçecekler, Öğle Yemeği, Gece Eğlencesi",30.0,30.0
Venezia Restaurant,"Fevziye Cad. Vicenza Otel No:3 K:Giris Vefa, Fatih, İstanbul Türkiye,İnternet sitesi","İtalyan,Avrupa","Kahvaltı, Öğle Yemeği, Akşam Yemeği",69,5201701,,4.0,"Rezervasyonlar, Oturma, Masaya Servis, Açık Havada Oturma, Alkol Var",30.0,30.0
Happy Moon's,"Bahariye Cad. Nazmi Bey Sok. No:5, İstanbul Türkiye,İnternet sitesi","Kafe,Uluslararası,Vejetaryen Dostu",Vejetaryen Dostu,64,+90 216 349 84 22,,4.0,"Kahvaltı, Öğle Yemeği, Akşam Yemeği, Brunch",30.0,30.0
Garden İskender,"Halaskargazi Caddesi, Ebekızı Sokak, No:2 Osmanbey, İstanbul 34363 Türkiye,İnternet sitesi,Menü","Türk,Ortadoğu,Helal","Ortadoğu, Türk",38,+90 212 247 45 77,10-50,4.0,Helal,30.0,30.0
Que  Tal Tapas Bar & Cafe,"Ilk Belediye Cad. No. 5/A, İstanbul Türkiye,İnternet sitesi,Menü","Akdeniz,Avrupa,İspanyol","Kahvaltı, Öğle Yemeği, Akşam Yemeği",37,244 4140,,4.0,"Alkol Var, Rezervasyonlar, Açık Havada Oturma, Oturma, Masaya Servis",30.0,30.0
SULTAN'S RESTAURANT,"Torun Sok. Otel Sultanahmet Sarayı No:19 Sultanahmet, Fatih Sultanahmet Palace Hotel, İstanbul 34400 Türkiye,İnternet sitesi",Türk,"Kahvaltı, Öğle Yemeği, Akşam Yemeği",27,+90 212 458 04 60,,4.0,Oturma,30.0,30.0
Borgo Kitchen+Bar,"Ambarlıdere Cad. No: 6/7 Beşiktaş, Ulus, Lotus World, İstanbul 34347 Türkiye,İnternet sitesi,Menü","Akdeniz,Vejetaryen Dostu",Vejetaryen Dostu,8,+90 212 216 16 88,,4.0,"Kahvaltı, Öğle Yemeği, Akşam Yemeği",30.0,30.0
Ecevitler Gıda Pazarı,"Gunesli Bahce Sokak. No:20 Kadikoy, İstanbul 34714 Türkiye,İnternet sitesi","Türk,Şarküteri","Kahvaltı, Öğle Yemeği, Akşam Yemeği",7,+90 216 345 61 41,,4.0,"Paket Yemek, Oturma, Tekerlekli Sandalye İle Erişim, American Express Kabul Ediliyor, Mastercard Kabul Ediliyor, Visa Kabul Ediliyor, Ücretsiz Wifi, Kredi Kartı Geçerli",30.0,30.0
Sisli Sultanahmet Izgara,"Cumhuriyet, Halaskargazi Cd. No:69, İstanbul 34373 Türkiye,İnternet sitesi,Menü","Biftek Restoranı,Fast Food,Türk","Biftek Restoranı, Fast Food, Türk, Mangal",6,+90 212 235 05 05,15-45,4.0,"Kahvaltı, Öğle Yemeği, Akşam Yemeği, İçecekler",30.0,30.0
Ümraniye Belediyesi Tantavi Sosyal Tesisleri,"Tantavi Mahallesi Menteşoğlu Caddesi Karayusuf Sokak No:7, İstanbul 34764 Türkiye,İnternet sitesi","Kafe,Fast Food,Türk","Kafe, Fast Food, Türk",1,+90 216 611 12 30,10-50,4.0,"Kahvaltı, Öğle Yemeği, Akşam Yemeği",30.0,30.0
Iskele Restaurant,"Beylerbeyi İskele Cad. No. 13B, İstanbul Türkiye,İnternet sitesi,Menü",Deniz Mahsülleri,"Öğle Yemeği, Akşam Yemeği, Gece Eğlencesi",43,422 2229,,4.0,"Rezervasyonlar, Alkol Var, Oturma, Masaya Servis",29.5,29.5
Tatar Salim Döner Lokantası,"Atilla İlhan Cad. Efe Sok. No:2/1 Küçükbakkalköy / Ataşehir, İstanbul 34750 Türkiye,İnternet sitesi","Türk,Helal",Helal,423,+90 216 408 26 26,,4.0,"Öğle Yemeği, Akşam Yemeği",29.0,29.0
Luzia İstanbul,"Arnavutkoy Bebek Caddesi, No:64 Arnavutkoy, İstanbul 34345 Türkiye,İnternet sitesi","Akdeniz,Türk","Akdeniz, Türk",27,+90 530 076 28 62,10-48,4.0,"Brunch, Gece Eğlencesi, Kahvaltı, Öğle Yemeği, Akşam Yemeği",29.0,29.0
Düzgün Et,"Site Mah. Cevahir Cad. Kerim sok. No:34/1 Umraniye, İstanbul 34760 Türkiye,İnternet sitesi,Menü","Biftek Restoranı,Türk","Biftek Restoranı, Türk",14,+90 216 533 07 18,14-44,4.0,"Kahvaltı, Öğle Yemeği, Akşam Yemeği",29.0,29.0
Sur Ocakbaşı,"Zeyrek Mah. İtfaiye Cad. No: 19 Fatih, Fatih Kadınlar Pazarı, İstanbul 34083 Türkiye,İnternet sitesi,Menü","Türk,Ortadoğu,Helal",Helal,368,+90 212 533 80 88,,4.0,"Öğle Yemeği, Akşam Yemeği, Gece Eğlencesi",28.0,28.0
Kanatçı Haydar,"Kocasinan Merkez Mah. Ahlat Sok. No:18/A Kocasinan, Bahçelievler, İstanbul 34192 Türkiye,İnternet sitesi,Menü","Barbekü,Türk,Helal",Helal,172,+90 212 503 71 73,,4.0,"Öğle Yemeği, Akşam Yemeği, Gece Eğlencesi",28.0,28.0
Choppers Point İstanbul,"Yeşilköy Mahallesi, Atatürk Caddesi No: 15-17-19 Bakırköy, WOW Istanbul Hotels & Convention Center, Dünya Ticaret Merkezi, İstanbul 34149 Türkiye,İnternet sitesi,Menü","Amerikan,Avrupa,Bar","Öğle Yemeği, Akşam Yemeği, İçecekler",131,+90 212 468 50 10,,4.0,"Rezervasyonlar, Açık Havada Oturma, Oturma, Otopark Var, İndirimli Park Hizmeti, Vale Otopark, Televizyon, Bebek Sandalyesi Var, Tekerlekli Sandalye İle Erişim, Alkol Var, Tüm İçkiler, Ücretsiz Wifi, Kredi Kartı Geçerli, Masaya Servis, Şarap ve Bira",28.0,28.0
!Nu Noodle,"Siraselviler Cad. No:60 Cihangir, Beyoglu, İstanbul 34433 Türkiye,İnternet sitesi","Çin,Fast Food,Asya","Asya, Çin, Fast Food",5,+90 212 244 88 99,15-40,4.0,Vejetaryen Dostu,27.5,27.5
KAT 3 Kuzguncuk,"Kuzguncuk Mahallesi, Paşalimanı Caddesi No: 126\3 Üsküdar, İstanbul 34674 Türkiye,İnternet sitesi",Türk,Türk,2,+90 216 343 22 52,15-40,4.0,"Öğle Yemeği, Akşam Yemeği",27.5,27.5
Galata Kulesi,"Bereketzade Mah. Büyük Hendek Sok. No:2 Beyoğlu Şişhane, İstanbul Türkiye,İnternet sitesi,Menü","Türk,Helal",Helal,338,2938183,,4.0,"Öğle Yemeği, Akşam Yemeği, Gece Eğlencesi",25.0,25.0
Nusret,"Cevdet Paşa Cad. Manolya Sok. No:1 Bebek, İstanbul Türkiye,İnternet sitesi,Menü","Biftek Restoranı,Barbekü,Avrupa",Helal,288,2654502,,4.0,"Öğle Yemeği, Akşam Yemeği, Gece Eğlencesi",25.0,25.0
Tükkan,"Kemankeş Karamustafapaşa Mahallesi, Mumhane Caddesi No: 34 Karaköy, Beyoğlu, İstanbul 34425 Türkiye,İnternet sitesi","İtalyan,Fransız,Amerikan","Avrupa, İtalyan, Fransız, Amerikan, Türk",77,+90 212 245 31 31,5-45,4.0,Vejetaryen Dostu,25.0,25.0
Kanlıca Yakamoz Restaurant,"Kanlıca İskelesi Yanı No: 1 Beykoz, Kanlıca, İstanbul Türkiye,İnternet sitesi,Menü",Deniz Mahsülleri,Deniz Mahsülleri,62,+90 216 331 00 13,20-30,4.0,"Öğle Yemeği, Brunch, Akşam Yemeği, Kahvaltı",25.0,25.0
Athyra Lounge and Sports,"Ünlüsoy Caddesi No.26 Mimaroba, Büyükçekmece, İstanbul 34535 Türkiye,İnternet sitesi,Menü","Amerikan,Akdeniz,Avrupa","Amerikan, Akdeniz, Avrupa, Türk",23,+90 212 863 17 55,10-40,4.0,"Kahvaltı, Öğle Yemeği, Akşam Yemeği, Brunch, İçecekler",25.0,25.0
Öz Çardak Cafe,"Asmalimescit Mahallesi, İstiklal Caddesi, Hangeçidi Sokak Hazzo Pulo Pasajı, No 116/C Beyoğlu, İstanbul 34080 Türkiye,İnternet sitesi,Menü",Türk,Türk,8,+90 212 292 20 10,10-40,4.0,"Kahvaltı, Öğle Yemeği, Akşam Yemeği",25.0,25.0
Fasuli Lokantaları,"Hocapaşa Mah. Muradiye Cad. No:35 Fatih Eminönü/Cağaloğlu, İstanbul Türkiye,İnternet sitesi,Menü","Türk,Helal",Helal,109,5285053,,4.0,"Öğle Yemeği, Akşam Yemeği",24.0,24.0
Çimen,"Aziz Mahmut Hüdayi Mahallesi, Hakimiyet-i Milliye Cd. No: 56 Üsküdar, İstanbul Türkiye,İnternet sitesi",Türk,"Kahvaltı, Brunch, Akşam Yemeği",87,+90 216 339 64 51,,4.0,"Masaya Servis, Tekerlekli Sandalye İle Erişim",24.0,24.0
Midyeci Koray Bakırköy,"Hallaç Hüseyin Sk. 11-7 Cevizlik, İstanbul 34142 Türkiye,İnternet sitesi,Menü","Deniz Mahsülleri,Akdeniz,Türk","Deniz Mahsülleri, Akdeniz, Türk, Sokak Yemekleri",8,+90 212 653 42 43,5-42,4.0,"Öğle Yemeği, Akşam Yemeği, İçecekler",23.5,23.5
Ravouna 1906,"Istiklal Caddesi, No: 201 Hollanda Konsolosluğu Yanı, İstanbul Türkiye,İnternet sitesi,Menü","Kafe,Türk,Şarap Barı","Kafe, Şarap Barı, Türk",115,+90 212 924 87 60,20-25,4.0,Vejetaryen Dostu,22.5,22.5
Zurich Cafe,"Şehzadebaşı Caddesi, Vidinli Tevfik Paşa Cad. No: 14 Laleli, Fatih, Zurich Hotel, İstanbul Türkiye,İnternet sitesi","Uluslararası,Vejetaryen Dostu",Vejetaryen Dostu,96,+90 212 512 23 50,,4.0,"Akşam Yemeği, Kahvaltı, Öğle Yemeği",22.5,22.5
Kitchenette,"Buyukdere Cad. Kanyon Alisveris Merkezi No:168 Levent, Besiktas Kanyon AVM, İstanbul Türkiye,İnternet sitesi,Menü",Uluslararası,"Kahvaltı, Brunch",14,3530686,,4.0,"Tekerlekli Sandalye İle Erişim, Masaya Servis",22.5,22.5
Ovalı Konya Mutfağı,"Kartaltepe Mah. E-5 Karayolu Göktepe Sok. No:2 D:1 Küçükçekmece Sefaköy, İstanbul Türkiye,İnternet sitesi","Türk,Helal",Helal,140,4246534,,4.0,"Öğle Yemeği, Akşam Yemeği, Kahvaltı",22.0,22.0
McDonald's,"Aksaray Mah. Mustafa Kemal Cad. No:31 Aksaray, Fatih, İstanbul Türkiye,İnternet sitesi",Fast Food,Öğle Yemeği,22,5876671,,4.0,Paket Yemek,21.5,21.5
Roof Bar & Restaurant,"Kucuk Ayasofya Cad. No:35 Sultanahmet, Fatih, İstanbul Türkiye,İnternet sitesi",Türk,Akşam Yemeği,19,6388525,,4.0,"Oturma, Masaya Servis",21.5,21.5
LezzetCo Döner,"Valikonagi Caddesi, No:73/A Nişantaşı, İstanbul 34363 Türkiye,İnternet sitesi","Fast Food,Türk,Helal","Türk, Fast Food",29,+90 212 230 20 60,16-25,4.0,Helal,20.5,20.5
Dürümcü Emmi,"Osmanağa Mah. Mahmut Baba Cad. No:11 Kadıköy İtfaiye Karşsı, Kadıköy, İstanbul Türkiye,İnternet sitesi,Menü","Türk,Çorbalar,Helal","Türk, Çorbalar",1196,+90 216 348 18 86,10-30,4.0,Helal,20.0,20.0
Tepeli Konya Mutfağı & Kebap,"Topselvi Mah. D-100 Güneyyanyol Cd. No: 12 Kartal, İstanbul 34873 Türkiye,İnternet sitesi,Menü","Fast Food,Türk,Lokanta","Türk, Fast Food, Lokanta, Çorbalar",10,+90 216 353 55 56,14-26,4.0,"Brunch, Kahvaltı, Öğle Yemeği, Akşam Yemeği",20.0,20.0
Beco's Restaurant & Bar,"Firüzağa Mah. Cezayir Sok. No: 16 Beyoğlu, İstanbul Türkiye,İnternet sitesi","Fransız,Uluslararası,Türk","Türk, Fransız, Uluslararası",12,+90 212 346 01 66,7-32,4.0,Akşam Yemeği,19.5,19.5
Portaxe,"Baltalimani Cad. No:80-82 Rumelihisari, Sariyer, İstanbul Türkiye,İnternet sitesi",Uluslararası,Akşam Yemeği,54,2778233,,4.0,Rezervasyonlar,18.5,18.5
Park Samdan,"Mim Kemal Oke Cad. No:18 Tesvikiye, Sisli, İstanbul Türkiye,İnternet sitesi,Menü","Uluslararası,Akdeniz,Avrupa","Öğle Yemeği, Akşam Yemeği",37,2250710,,4.0,"Rezervasyonlar, Oturma, Masaya Servis",18.5,18.5
Kebap Hocası,"Küçükyalı Mahallesi, Bağdat Caddesi No: 106/B Maltepe, İstanbul 34840 Türkiye,İnternet sitesi,Menü",Türk,Türk,34,+90 216 388 56 86,5-32,4.0,"İçecekler, Öğle Yemeği, Akşam Yemeği",18.5,18.5
Tonoz Restaurant,"sehsuvar bey mahallesi cakmak tasi sokak no:17/19 kumkapi-Istanbul, İstanbul 34122 Türkiye,İnternet sitesi","Deniz Mahsülleri,Akdeniz,Türk","Öğle Yemeği, Akşam Yemeği",32,+90 212 517 11 22,,4.0,"Rezervasyonlar, Oturma, Masaya Servis",18.0,18.0
Hori Japanese Restaurant,"TaskIsla Caddesi, No:1, 34437 Taksim Grand Hyatt İstanbul, İstanbul 34437 Türkiye,İnternet sitesi","Japon,Suşi","Akşam Yemeği, Öğle Yemeği",17,+90 212 230 90 00,,4.0,"Rezervasyonlar, Oturma, Masaya Servis",18.0,18.0
PiDEZZA.ist,"Yenişehir Mh. Bakü Cd. No:6/18, İstanbul 34912 Türkiye,İnternet sitesi,Menü","Pizza,Kafe,Türk","Pizza, Kafe, Türk",1,+90 533 406 70 55,5-30,4.0,"Öğle Yemeği, Akşam Yemeği",17.5,17.5
TUANA DURAS CAFE,"Umut Reis Caddesi No:3/B2 Fatih Mahallesi, İstanbul 34500 Türkiye,İnternet sitesi,Menü","Kafe,Fast Food,Uluslararası","Fast Food, Türk, Kafe, Uluslararası",1,+90 538 277 56 56,5-30,4.0,"Kahvaltı, Öğle Yemeği, Akşam Yemeği, Brunch, İçecekler",17.5,17.5
Taps,"Cevdet Pasa Caddesi No:119 Bebek, İstanbul 34342 Türkiye,İnternet sitesi,Menü","Bar,Bar","Bar, Bar",268,+90 212 263 87 00,4-30,4.0,"Akşam Yemeği, Öğle Yemeği, Gece Eğlencesi, İçecekler",17.0,17.0
Serez Dondurmacisi - Kartal,"Kordonboyu Mah. Akdeniz Rd. No:4/A, İstanbul 34860 Türkiye,İnternet sitesi,Menü",no input,"Gece Eğlencesi, İçecekler",71,+90 850 259 7374,4-30,4.0,"Dışarı Yemek Servisi, Paket Yemek, Açık Havada Oturma, Oturma, Cadde Üzerinde Park, Ücretsiz Yol Üstü Olmayan Park Yeri, Bebek Sandalyesi Var, Tekerlekli Sandalye İle Erişim, Kredi Kartı Geçerli",17.0,17.0
Serez Dondurmacısı - Bakırköy,"Kartaltepe Mah. Ahu Sokak No: 4 A-B, İstanbul 34145 Türkiye,İnternet sitesi,Menü",Türk,Türk,1,+90 850 259 7374,4-30,4.0,"Kahvaltı, Öğle Yemeği, Akşam Yemeği, Brunch, Gece Eğlencesi, İçecekler",17.0,17.0
İkamet Döner,"Mahmutbey Mahallesi, Taşocağı Yolu No: 19/3C Balance Güneşli, İstanbul 34212 Türkiye,İnternet sitesi,Menü",Türk,Türk,158,+90 212 462 22 22,12-21,4.0,"Oturma, Kredi Kartı Geçerli, Masaya Servis",16.5,16.5
Cemile Sultan Korusu,"Kandilli Mah. Ömürtepe Yokuşu Sok. No: 6 Üsküdar, İstanbul Türkiye,İnternet sitesi",Türk,"Öğle Yemeği, Akşam Yemeği, Brunch",158,+90 216 308 49 43,,4.0,"Rezervasyonlar, Masaya Servis",16.5,16.5
NOPA Restaurant and Grill,"6 Atiye Sokak 6 Atiye Sokak, 34360, Istanbul, İstanbul 34360 Türkiye,İnternet sitesi","İtalyan,Biftek Restoranı,Avrupa","Akşam Yemeği, Öğle Yemeği, Gece Eğlencesi",97,+90 212 327 58 68,,4.0,"Rezervasyonlar, Açık Havada Oturma, Oturma, Alkol Var, Tüm İçkiler, Masaya Servis",16.5,16.5
Kahire Restoranı,"Halaskargazi Cd. No:122 Meşrutiyet Mahallesi, İstanbul 34363 Türkiye,İnternet sitesi,Menü","Türk,Ortadoğu,Mısır","Türk, Mısır, Ortadoğu, Arap",28,+90 543 943 60 10,13-20,4.0,Helal,16.5,16.5
