titleRestaurant,adress,information,kitchens,number_of_comments,phoneNumber,price,score,special_types_of_diets,average_price,price_min
Geppetto,"Atatürk Mahallesi, Kordonboyu Cd. No: 111 Büyükçekmece, İstanbul 34500 Türkiye,İnternet sitesi","İtalyan,Biftek Restoranı,Bar","Bar, Gastropub, İtalyan, Biftek Restoranı, Şarap Barı",765,+90 212 881 54 65,213-709,4.5,"Kahvaltı, Öğle Yemeği, Akşam Yemeği, Brunch, Gece Eğlencesi, İçecekler",461.0,461.0
Meşhur Tavacı Recep Usta,"Altıntepe Mahallesi, Eski Bağdat Caddesi No: 6/1 Bostancı İskele Karşısı, İstanbul 34834 Türkiye,İnternet sitesi,Menü",Türk,"Akşam Yemeği, Kahvaltı, Öğle Yemeği",262,+90 216 367 19 78,,4.5,"Rezervasyonlar, Tekerlekli Sandalye İle Erişim",461.0,461.0
Babel Ocakbaşı Nevizade,"Kameriye Sk. No:7 Hüseyinaga Mahallesi, İstanbul 34435 Türkiye,İnternet sitesi,Menü","Akdeniz,Barbekü,Türk","Barbekü, Türk, Ortadoğu, Akdeniz, Mangal",225,+90 212 244 64 60,213-709,4.5,"Vejetaryen Dostu, Helal",461.0,461.0
Şehzade Restaurant,"Kocatepe Mah. Abdülhak Hamit Cad. No: 19/1, İstanbul Türkiye,İnternet sitesi,Menü","Türk,Helal",Helal,321,+90 212 361 08 49,,4.5,"Kahvaltı, Akşam Yemeği, Gece Eğlencesi",450.0,450.0
Beyti Restaurant,"Orman Caddesi No: 8 Florya, İstanbul Türkiye,İnternet sitesi,Menü","Barbekü,Türk,Helal","Barbekü, Türk",776,+90 212 663 29 90,177-709,4.5,"Helal, Glütensiz Seçenekler",443.0,443.0
Rana by Topaz,"İnönü Caddesi No: 50 Ömer Avni Mahallesi, İstanbul Türkiye,İnternet sitesi,Menü","Akdeniz,Avrupa,Türk","Türk, Çağdaş, Akdeniz, Avrupa",746,+90 212 249 10 01,177-709,4.5,"Vejetaryen Dostu, Vegan Seçenekleri, Glütensiz Seçenekler",443.0,443.0
Sur Balık Cihangir,"Kılıçali Paşa Mah. Akarsu Yokusu Cad. No: 36 - 36A Kat: 7, İstanbul Türkiye,İnternet sitesi,Menü","Deniz Mahsülleri,Akdeniz,Avrupa","Vegan Seçenekleri, Vejetaryen Dostu, Glütensiz Seçenekler",338,+90 212 245 10 87,,4.5,"Öğle Yemeği, Akşam Yemeği",443.0,443.0
Neoclassic,"Istiklal Cad. Ors Turistik Is Merkezi No:151 Kat 1 Taksim, Beyoglu, İstanbul Türkiye,İnternet sitesi","Uluslararası,Akdeniz,Avrupa","Akşam Yemeği, Brunch, Öğle Yemeği, Gece Eğlencesi, İçecekler",226,+90 212 292 48 13,,4.5,"Rezervasyonlar, Açık Havada Oturma, Oturma, Tüm İçkiler, Ücretsiz Wifi, Alkol Var, Masaya Servis",443.0,443.0
Mihri Restaurant,"Cankurtaran Mahallesi Ayasofya MeydanI No:2 Fatih / Isanbul, İstanbul 34122 Türkiye,İnternet sitesi,Menü","Avrupa,Türk,Ortadoğu","Vegan Seçenekleri, Helal",210,+90 212 517 73 73,,4.5,"Kahvaltı, Öğle Yemeği, Akşam Yemeği, Brunch",443.0,443.0
Laledan Restaurant,"Yıldız, Çırağan Cd. 32 Ciragan Palace Kempinski, İstanbul 34349 Türkiye,İnternet sitesi,Menü","Uluslararası,Akdeniz,Avrupa","Vejetaryen Dostu, Glütensiz Seçenekler, Vegan Seçenekleri",118,+90 212 236 73 33,,4.5,"Brunch, Kahvaltı",443.0,443.0
Wonderland,"Rumeli Hisari Mah. Nispetiye Cad. No:65/A Rumelihisari, Sariyer, İstanbul Türkiye,İnternet sitesi",Uluslararası,Uluslararası,26,2878476,177-709,4.5,"Öğle Yemeği, Akşam Yemeği",443.0,443.0
Marin Balık,"Hacıkasım Mahallesi, Liman Sokak No: 20 Şile, İstanbul 34980 Türkiye,İnternet sitesi","Deniz Mahsülleri,Akdeniz,Türk","Deniz Mahsülleri, Akdeniz, Türk",1312,+90 535 561 34 53,142-709,4.5,"Öğle Yemeği, Akşam Yemeği",425.5,425.5
Miyabi Sushi Restaurant,"Zeytinoglu Cad. Yaren Sok. No:6 14/15 Akatlar -Istanbul, İstanbul 34467 Türkiye,İnternet sitesi,Menü","Japon,Suşi,Asya",Vejetaryen Dostu,615,+90 212 352 02 22,,4.5,"Akşam Yemeği, Kahvaltı, Öğle Yemeği",425.5,425.5
Vue Rooftop,"Atakoy 2-5-6. Kisim, Rauf Orbay Caddesi Sahil Yolu No:2/1, İstanbul 34158 Türkiye,İnternet sitesi","Fransız,Amerikan,Bar","Vejetaryen Dostu, Glütensiz Seçenekler",585,+90 212 463 12 34,,4.5,"İçecekler, Akşam Yemeği, Gece Eğlencesi",425.5,425.5
Taç Balık Restaurant,"Cubuklu Mh. Piri Reis Caddesi No:10, Cubuklu/Beykoz, İstanbul 34815 Türkiye,İnternet sitesi,Menü","Deniz Mahsülleri,Akdeniz,Türk",Vejetaryen Dostu,258,+90 216 331 00 51,,4.5,"Öğle Yemeği, Akşam Yemeği, Gece Eğlencesi",425.5,425.5
Toro Latin GastroBar İstanbul,"Merkez Mah. Meserburnu Cad. No:7, Sarıyer, İstanbul 34450 Türkiye,İnternet sitesi,Menü","Meksika,Brezilya,Peru","Meksika, Brezilya, Peru, Latin, İspanyol, Arjantin, Güney Amerika",2,+90 531 266 13 46,298-553,4.5,"Öğle Yemeği, Akşam Yemeği",425.5,425.5
Yeniköy Yalıer 1 Balık Lokantası,"Sarıyer, Köybaşı Caddesi, 145, İstanbul Türkiye,İnternet sitesi","Deniz Mahsülleri,Akdeniz",Akşam Yemeği,18,+90 212 262 27 99,,4.5,"Rezervasyonlar, Tekerlekli Sandalye İle Erişim",425.0,425.0
Shang Palace,"Sinanpasa Mah, Hayrettin Iskelesi Sok, No.1, Besiktas, İstanbul 34353 Türkiye,İnternet sitesi,Menü","Çin,Asya,Kanton yemekleri","Çin, Asya",1708,+90 212 275 88 88,255-553,4.5,"Vejetaryen Dostu, Glütensiz Seçenekler",404.0,404.0
Sntrl Dükkan,"Fenerbahçe Mah. Erguvan Sok. No: 10/A Kadıköy, İstanbul 34760 Türkiye,İnternet sitesi","Kafe,Akdeniz,Türk",Vejetaryen Dostu,27,+90 216 330 70 99,,4.5,"Kahvaltı, Öğle Yemeği, Brunch, Akşam Yemeği",404.0,404.0
Matbah Ottoman Palace Cuisine,"Caferiye Sokak No: 6/1 Sultanahmet, İstanbul 34122 Türkiye,İnternet sitesi,Menü","Türk,Sağlıklı,Ortadoğu","Türk, Sağlıklı, Ortadoğu",1312,+90 212 514 61 51,213-532,4.5,"Vejetaryen Dostu, Vegan Seçenekleri, Helal, Glütensiz Seçenekler",372.5,372.5
Günaydın Kasap Steakhouse,"Nispetiye Cad. Seher Yildizi Sok. No:15/A Etiler, Beşiktaş, İstanbul 34330 Türkiye,İnternet sitesi,Menü","Biftek Restoranı,Barbekü,Avrupa","Biftek Restoranı, Barbekü, Avrupa, Türk",213,+90 212 265 52 52,177-532,4.5,Helal,354.5,354.5
Green Restaurant,"Çapariz Sk. No: 11 Kumkapı, İstanbul Türkiye,İnternet sitesi","Deniz Mahsülleri,Akdeniz,Barbekü","Barbekü, Türk, Deniz Mahsülleri, Akdeniz",40,+90 212 516 16 25,177-532,4.5,Vejetaryen Dostu,354.5,354.5
Mavi Balık,"Kuruçeşme Mah. Muallim Naci Cad. No:64 D:2 Kuruçeşme, Beşiktaş, İstanbul 34345 Türkiye,İnternet sitesi,Menü","Deniz Mahsülleri,Akdeniz,Avrupa","Deniz Mahsülleri, Akdeniz, Avrupa, Türk",373,+90 212 265 54 80,280-420,4.5,"Vejetaryen Dostu, Glütensiz Seçenekler",350.0,350.0
Latife Hanim Meyhanesi,"Istiklal Caddesi, Bekar Sokak No:22/A, İstanbul 34400 Türkiye,İnternet sitesi","Deniz Mahsülleri,Akdeniz,Türk","Deniz Mahsülleri, Akdeniz, Türk",303,+90 212 293 00 68,284-355,4.5,"Vejetaryen Dostu, Vegan Seçenekleri, Helal",319.5,319.5
5. Kat Restaurant & Cafe Bar,"Cihangir Mahallesi, Soğancı Sk. No: 3 Beyoğlu, Kat 5, İstanbul 34433 Türkiye,İnternet sitesi,Menü","Uluslararası,Akdeniz,Türk","Akdeniz, Türk, Uluslararası",1191,+90 212 293 37 74,177-461,4.5,"Vejetaryen Dostu, Vegan Seçenekleri, Glütensiz Seçenekler",319.0,319.0
PeriPetie Bistro,"istiklal caddesi,bekar sokak no:18, İstanbul 34430 Türkiye,İnternet sitesi","Bar,Akdeniz,Türk","Bar, Akdeniz, Türk, Bar",37,+90 212 245 20 11,142-496,4.5,Vejetaryen Dostu,319.0,319.0
Sita Balık Evi,"Balmumcu Barbaros Bulvarı No:64/2 Beşiktaş, İstanbul 34349 Türkiye,İnternet sitesi,Menü","Deniz Mahsülleri,Akdeniz,Türk","Deniz Mahsülleri, Türk, Akdeniz",20,+90 212 267 16 87,106-532,4.5,"Öğle Yemeği, Akşam Yemeği, Gece Eğlencesi, İçecekler",319.0,319.0
Gülhanepark Terrace Restaurant,"Nöbethane Street No:1, İstanbul 34100 Türkiye,İnternet sitesi","Çin,Alman,Deniz Mahsülleri","Çin, Alman, Deniz Mahsülleri, Akdeniz, Türk",15,+90 212 519 68 68,43-595,4.5,"Akşam Yemeği, Kahvaltı, Öğle Yemeği, Brunch, Gece Eğlencesi, İçecekler",319.0,319.0
Gunaydin,"Nispetiye Cad. Seher Yildizi Sok. No:6 Etiler, Besiktas, İstanbul Türkiye,İnternet sitesi,Menü","Barbekü,Türk,Ortadoğu",Helal,199,2650232,,4.5,"Öğle Yemeği, Akşam Yemeği",305.0,305.0
PS Lounge,"Etiler Mah. Nispetiye Cad. No: 100 Beşiktaş, İstanbul Türkiye,İnternet sitesi,Menü","Bar,Türk,Bar","Türk, Bar, Bar",213,+90 212 265 10 11,106-496,4.5,"Vejetaryen Dostu, Helal",301.0,301.0
The Upper Crust Pizzeria,"42, Ahi Evran Cd. No:6 D:190 Maslak, İstanbul 34485 Türkiye,İnternet sitesi,Menü","Amerikan,Pizza,Fast Food","Amerikan, Pizza, Fast Food",11,+90 212 276 19 00,35-567,4.5,"Öğle Yemeği, Akşam Yemeği",301.0,301.0
Mahir Lokantası,"Halaskargazi cad. Tavukçu Fethi sk. no: 28/b Şişli, İstanbul Türkiye,İnternet sitesi","Türk,Helal",Türk,48,+90 212 234 93 94,78-510,4.5,Helal,294.0,294.0
Calipso Fish,"Cumhuriyet Cad. No: 2, İstanbul 34840 Türkiye,İnternet sitesi,Menü","Deniz Mahsülleri,Uluslararası,Akdeniz","Deniz Mahsülleri, Akdeniz, Türk, Uluslararası, Yunan, Şarap Barı",108,+90 216 489 28 58,213-355,4.5,"Vejetaryen Dostu, Vegan Seçenekleri, Helal",284.0,284.0
Simple Istanbul,"Bankalar Cad. Şair Eşref Paşa Sok. No: 4 Galata, Walton Hotels Galata Teras, İstanbul 34420 Türkiye,İnternet sitesi","Fransız,Akdeniz,Türk","Türk, Fransız, Akdeniz",23,+90 212 243 12 43,128-440,4.5,Vejetaryen Dostu,284.0,284.0
Ada İstiklal,"İstiklal caddesi 158-A, İstanbul 34000 Türkiye,İnternet sitesi","Kafe,Akdeniz,Avrupa","Kafe, Akdeniz, Avrupa, Türk",134,+90 212 245 01 21,106-461,4.5,"Vejetaryen Dostu, Vegan Seçenekleri",283.5,283.5
Akıntıburnu,"Arnavutköy Mah. 1. Bebek Caddesi No: 115 Beşiktaş, İstanbul 34345 Türkiye,İnternet sitesi,Menü","Deniz Mahsülleri,Akdeniz,Türk","Deniz Mahsülleri, Akdeniz, Türk",83,+90 212 263 48 29,142-425,4.5,"Öğle Yemeği, Akşam Yemeği, Gece Eğlencesi",283.5,283.5
Kartallar Mavi Nokta Balık Restaurant,"Muhsine Hatun Mah. Çaparız Sokak 41/43 Kumkapı, İstanbul 34125 Türkiye,İnternet sitesi","Deniz Mahsülleri,Akdeniz,Türk","Deniz Mahsülleri, Türk, Akdeniz",50,+90 212 638 38 88,142-425,4.5,"Öğle Yemeği, Akşam Yemeği, Gece Eğlencesi",283.5,283.5
Sandal Balık,"Köybaşı Cad. No: 178 Sarıyer, Yeniköy, İstanbul 34443 Türkiye,İnternet sitesi,Menü","Deniz Mahsülleri,Türk","Türk, Deniz Mahsülleri",23,+90 212 262 04 05,142-425,4.5,"Öğle Yemeği, Akşam Yemeği",283.5,283.5
Pizza de Lavia,"Nobethane CD, İstanbul Türkiye,İnternet sitesi","Pizza,Fast Food,Türk","Vejetaryen Dostu, Vegan Seçenekleri",73,+90 212 514 86 80,,4.5,"Öğle Yemeği, Akşam Yemeği, Brunch",276.5,276.5
Gabbro Resto - Bar,"Vişnezade Mah. Acısu Sok. No: 19 Maçka, Beşiktaş, Swissotel The Bosphorus, İstanbul 34357 Türkiye,İnternet sitesi,Menü",Uluslararası,Uluslararası,37,+90 212 326 11 00,70-480,4.5,"Akşam Yemeği, Gece Eğlencesi, İçecekler",275.0,275.0
Pasaj Cook&Book,"No:81 Papatya Pasaji, Kadikoy, İstanbul 34710 Türkiye,İnternet sitesi","Türk,Vejetaryen Dostu,Vegan Seçenekleri","Vejetaryen Dostu, Vegan Seçenekleri",21,+90 216 414 44 00,,4.5,"Öğle Yemeği, Akşam Yemeği",275.0,275.0
Geyik,"Akarsu Yokuşu Sokak No: 22/A Cihangir, İstanbul 34433 Türkiye,İnternet sitesi","Kafe,Füzyon","Gece Eğlencesi, İçecekler",30,+90 532 773 00 13,,4.5,"Alkol Var, Oturma, Otopark Var, Tüm İçkiler, American Express Kabul Ediliyor, Mastercard Kabul Ediliyor, Visa Kabul Ediliyor, Ücretsiz Wifi, Açık Havada Oturma, Kredi Kartı Geçerli",268.0,268.0
Saraykapı Saç Tava,"Yeşilova Mah. Barbaros Cad. No:25 Küçükçekmece Sefaköy, İstanbul Türkiye,İnternet sitesi,Menü","Türk,Ortadoğu,Vejetaryen Dostu","Helal, Vejetaryen Dostu",39,5995915,,4.5,"Öğle Yemeği, Akşam Yemeği, Kahvaltı",266.0,266.0
Juno,"15 Mim Kemal Oke Street Nisantasi, İstanbul Türkiye,İnternet sitesi,Menü","İtalyan,Bar,Akdeniz","İtalyan, Bar, Avrupa, Akdeniz",216,+90 212 291 57 23,106-425,4.5,"Vejetaryen Dostu, Vegan Seçenekleri, Glütensiz Seçenekler",265.5,265.5
Kapı Karaköy,"Kemankeş Karamustafapaşa Mah. Başcerrah Sokak. No: 4 Karaköy, İstanbul Türkiye,İnternet sitesi,Menü","Türk,Mangal,Lokanta","Öğle Yemeği, Akşam Yemeği, Gece Eğlencesi, İçecekler",98,+90 212 292 59 67,,4.5,"Rezervasyonlar, Açık Havada Oturma, Masaya Servis, Cadde Üzerinde Park, Tekerlekli Sandalye İle Erişim, Alkol Var, Tüm İçkiler, Şarap ve Bira, Dijital Ödemeler, Ücretsiz Wifi",265.5,265.5
Figaro's Restaurant,"Osman Gurer Sok. No:4 Yesilkoy Spor Kulubu Yani, İstanbul 34149 Türkiye,İnternet sitesi","Deniz Mahsülleri,Akdeniz,Türk","Türk, Deniz Mahsülleri, Akdeniz",123,+90 212 573 43 83,12-500,4.5,"Vejetaryen Dostu, Vegan Seçenekleri",256.0,256.0
Ist Too,"Sinanpaşa Mah, Hayrettin İskelesi Sok. No: 1 Beşiktaş, İstanbul 34353 Türkiye,İnternet sitesi,Menü","Suşi,Türk,Vejetaryen Dostu","Suşi, Türk",160,+90 212 275 88 88,170-340,4.5,"Vejetaryen Dostu, Vegan Seçenekleri, Helal, Glütensiz Seçenekler",255.0,255.0
Alpek Teras Restaurant,"Hobyar Mah. Arpacılar Cad. No: 6 Eminönü, İstanbul Türkiye,İnternet sitesi,Menü","Türk,Vejetaryen Dostu,Vegan Seçenekleri","Vejetaryen Dostu, Vegan Seçenekleri",931,+90 212 514 45 88,,4.5,"Kahvaltı, Öğle Yemeği, Akşam Yemeği, Brunch",250.0,250.0
Selvi Restaurant,"Sıraselviler Cad. No: 6/1 Taksim, Beyoğlu, İstanbul Türkiye,İnternet sitesi","Türk,Ortadoğu,Vejetaryen Dostu","Vejetaryen Dostu, Vegan Seçenekleri, Helal",628,2938964,,4.5,"Öğle Yemeği, Akşam Yemeği, Kahvaltı, Gece Eğlencesi",250.0,250.0
Ioki,"Kandilli Mahallesi, Kandilli Cad. No:11/A Üsküdar, İstanbul 34684 Türkiye,İnternet sitesi,Menü","Japon,Suşi,Asya","Vejetaryen Dostu, Vegan Seçenekleri",321,+90 216 202 20 22,,4.5,"Öğle Yemeği, Akşam Yemeği",250.0,250.0
Bab-ı Âli Kahvesi,"Demirtaş Mah. Fetva Yokuşu No: 16/A Fatih, İstanbul 34134 Türkiye,İnternet sitesi",no input,"Kahvaltı, Öğle Yemeği, Akşam Yemeği",9,+90 212 493 19 88,142-355,4.5,Masaya Servis,248.5,248.5
Şans Restaurant,"Hacı Adil Cad. Palmiye Sok. No:1 Levent, Beşiktaş, İstanbul 34330 Türkiye,İnternet sitesi,Menü","Akdeniz,Avrupa,Türk","Akdeniz, Avrupa, Türk, Çağdaş",349,+90 212 280 38 38,71-425,4.5,"Vejetaryen Dostu, Vegan Seçenekleri, Glütensiz Seçenekler",248.0,248.0
Metet Kozde Doner,"İcadiye Cad. İnci Çayırlı Sok.  No:2 Kuzguncuk Mah., İstanbul 34674 Türkiye,İnternet sitesi","Türk,Lokanta,Helal","Türk, Lokanta",129,+90 216 553 33 33,227-262,4.5,Helal,244.5,244.5
Terrace 41,"Kuloğlu Mahallesi, Turnacıbaşı Sokak No: 41 Beyoğlu, Cihangir, Corinne Hotel, İstanbul 34433 Türkiye,İnternet sitesi","Meksika,Bar,Avrupa","Meksika, Türk, Bar, Şarap Barı, Bar, Avrupa",47,+90 505 983 41 41,142-347,4.5,"Vejetaryen Dostu, Vegan Seçenekleri, Helal",244.5,244.5
Tria Elegance Restaurant,"Akbiyik Caddesi Number :11 Sultanahmet, İstanbul 34122 Türkiye,İnternet sitesi,Menü","Uluslararası,Akdeniz,Avrupa","Avrupa, Türk, Uluslararası, Akdeniz",1082,+90 212 518 45 18,43-425,4.5,"Vejetaryen Dostu, Glütensiz Seçenekler",234.0,234.0
Pano Şarap Evi,"Hüseyinağa Mahallesi, Hamalbaşı Cd. No: 12/B Taksim, Beyoğlu, İstanbul 34435 Türkiye,İnternet sitesi,Menü","Uluslararası,Şarap Barı,Yemekli barlar","Vejetaryen Dostu, Vegan Seçenekleri",65,+90 212 292 66 64,,4.5,"Öğle Yemeği, Akşam Yemeği, Gece Eğlencesi, İçecekler",234.0,234.0
Special Et Steak House,"Adnan Kahveci Bulv. 564.Sok Esenyurt, İstanbul 34522 Türkiye,İnternet sitesi","Meksika,Amerikan,Türk","Meksika, Amerikan, Türk",4,+90 212 803 04 33,106-355,4.5,"Kahvaltı, Öğle Yemeği, Akşam Yemeği",230.5,230.5
16 Roof,"Vişnezade Mah. Acisu Sok. No:19 Swissotel The Bosphorus, Istanbul 16th Floor, Maçka, Beşiktaş, İstanbul 34357 Türkiye,İnternet sitesi,Menü","Peru,Bar,Akdeniz","Peru, Akdeniz, Türk, Bar, Bar",84,+90 212 326 11 00,55-400,4.5,"Vejetaryen Dostu, Vegan Seçenekleri",227.5,227.5
Salute Pub & Restaurant,"Ebusuud Cad. Safettipasa Sok. No:6, İstanbul 34110 Türkiye,İnternet sitesi","Bar,Akdeniz,Türk","Bar, Akdeniz, Türk, Bar, Mangal",679,+90 212 527 85 50,26-425,4.5,"Vejetaryen Dostu, Vegan Seçenekleri, Helal, Glütensiz Seçenekler",225.5,225.5
Emilia Cafe,"Suadiye, Kazım Özalp Sk. No:3, İstanbul 34740 Türkiye,İnternet sitesi,Menü","Kafe,Uluslararası,Avrupa","Kahvaltı, Öğle Yemeği, Akşam Yemeği, Brunch, İçecekler",68,+90 216 350 00 30,,4.5,"Rezervasyonlar, Özel Yemek, Oturma, Cadde Üzerinde Park, Bebek Sandalyesi Var, Tekerlekli Sandalye İle Erişim, Ücretsiz Wifi, Kredi Kartı Geçerli, Masaya Servis, Aile tarzı, Sigara içilmeyen restoranlar",225.5,225.5
Albura Kathisma,"Cankurtaran Mah. Yeni Akbıyık Cad. No: 36-38, İstanbul 34122 Türkiye,İnternet sitesi","Deniz Mahsülleri,Uluslararası,Akdeniz","Deniz Mahsülleri, Uluslararası, Ortadoğu, Akdeniz, Türk",2330,+90 212 517 90 31,64-369,4.5,"Vejetaryen Dostu, Vegan Seçenekleri, Helal, Glütensiz Seçenekler",216.5,216.5
Burgerillas Burger&Steakhouse,"Rüstem Paşa Mahallesi, Asmaaltı Caddesi, Büyükbaş Sokak No: 3/C Eminönü, İstanbul 34050 Türkiye,İnternet sitesi,Menü","Amerikan,Fast Food,Vejetaryen Dostu","Amerikan, Fast Food",167,+90 212 519 76 76,71-355,4.5,Vejetaryen Dostu,213.0,213.0
Halat Restaurant,"Kumbarhane Cad. Rahmi M. Koç Müzesi No:2 Hasköy, Beyoğlu, İstanbul Türkiye,İnternet sitesi","Akdeniz,Vejetaryen Dostu",Vejetaryen Dostu,91,3696616,,4.5,Akşam Yemeği,213.0,213.0
Panaromic Terrace,"Ebusud  Caddesi No: 26 Sirkeci, Golden Horn Hotel Çatı Katı, İstanbul 34410 Türkiye,İnternet sitesi","Deniz Mahsülleri,Uluslararası,Türk","Deniz Mahsülleri, Uluslararası, Türk",54,+90 212 519 74 74,71-355,4.5,"Kahvaltı, Akşam Yemeği, Brunch, Gece Eğlencesi",213.0,213.0
Greecology,"Cihangir Caddesi, No:1/A, İstanbul 34433 Türkiye,İnternet sitesi","Akdeniz,Yunan,Vejetaryen Dostu",Vejetaryen Dostu,20,+90 212 243 20 53,,4.5,"Kahvaltı, Akşam Yemeği, Öğle Yemeği, Brunch, İçecekler",213.0,213.0
Neyzade Restaurant,"Taya Hatun Sok. No. 5, İstanbul 34120 Türkiye,İnternet sitesi","Deniz Mahsülleri,Akdeniz,Avrupa","Türk, Çorbalar, Deniz Mahsülleri, Akdeniz, Avrupa",537,+90 212 528 43 44,177-248,4.5,"Vejetaryen Dostu, Glütensiz Seçenekler",212.5,212.5
Moda Kokoreç,"Osmanağa Mahallesi, Serasker Caddesi No: 100 Kadıköy, İstanbul 34714 Türkiye,İnternet sitesi","Türk,Sokak Yemekleri","Türk, Sokak Yemekleri",105,+90 216 349 34 35,106-319,4.5,"Öğle Yemeği, Akşam Yemeği",212.5,212.5
The Home Terrace Restaurant,"Kucukayasofya Caddesi, No:60, İstanbul 34122 Türkiye,İnternet sitesi","Türk,Vejetaryen Dostu",Türk,8,+90 212 638 88 01,77-340,4.5,Vejetaryen Dostu,208.5,208.5
Mahzen Restaurant,"Hüseyinağa Mahallesi, İstiklal Caddesi, Çiçek Pasajı, No:4/6 Beyoğlu, İstanbul 34000 Türkiye,İnternet sitesi","Biftek Restoranı,Hint,Akdeniz","Biftek Restoranı, Hint, Akdeniz, Türk, Yunan",9,+90 212 249 03 29,50-355,4.5,"Öğle Yemeği, Akşam Yemeği",202.5,202.5
Jabel Restaurant,"Muallim Naci cad no 54 Kuruçeşme Mahallesi, İstanbul 34345 Türkiye,İnternet sitesi,Menü","Lübnan,Akdeniz,Türk","Lübnan, Akdeniz, Türk, Ortadoğu, Arap",2,+90 539 207 42 22,53-349,4.5,"Kahvaltı, Öğle Yemeği, Akşam Yemeği, Gece Eğlencesi, İçecekler",201.0,201.0
Cemiyet,"Nergis Sk. No:8/3 Asmalı Mescit Mahallesi, İstanbul 34430 Türkiye,İnternet sitesi,Menü","Akdeniz,Türk,Ortadoğu","Öğle Yemeği, Akşam Yemeği, Gece Eğlencesi, İçecekler",27,+90 212 243 26 85,,4.5,"Açık Havada Oturma, Oturma, Alkol Var, Tüm İçkiler, Şarap ve Bira, Ücretsiz Wifi, Aile tarzı, Sigara içilmeyen restoranlar",200.0,200.0
Fine Dine Istanbul,"Dr. Imran Oktem Cd. No:4 Sultanahmet Fatih, İstanbul 34400 Türkiye,İnternet sitesi","Uluslararası,Akdeniz,Avrupa","Akdeniz, Avrupa, Türk, Ortadoğu, Uluslararası, Füzyon, Sağlıklı",483,+90 212 516 96 96,128-255,4.5,"Vejetaryen Dostu, Vegan Seçenekleri, Glütensiz Seçenekler, Helal",191.5,191.5
ZUMA,"Istinye Park, no: 461 Sariyer, İstanbul 34460 Türkiye,İnternet sitesi,Menü","Japon,Deniz Mahsülleri,Suşi","Vejetaryen Dostu, Vegan Seçenekleri, Glütensiz Seçenekler",264,+90 212 236 22 96,,4.5,"Öğle Yemeği, Akşam Yemeği, İçecekler",191.5,191.5
Esmer Chef,"Asmalı Mescid Mahallesi, İstiklal Caddesi No: 126/A Beyoğlu, İstanbul Türkiye,İnternet sitesi","İtalyan,Pizza,Kafe","İtalyan, Kafe, Akdeniz, Türk, Pizza, Avrupa",125,+90 212 249 69 99,50-326,4.5,"Vejetaryen Dostu, Vegan Seçenekleri",188.0,188.0
Ahsen,"İstiklal Cd. No: 82 Hüseyinağa Mahallesi, İstanbul 34435 Türkiye,İnternet sitesi,Menü","Kafe,Fast Food,Uluslararası",Helal,24,+90 212 293 22 58,,4.5,"Kahvaltı, Öğle Yemeği, Akşam Yemeği",187.5,187.5
Cooking Alaturka,"Cankurtaran Mahallesi, Akbıyık Caddesi No: 72/A Fatih, Sultanahmet, İstanbul Türkiye,İnternet sitesi,Menü","Akdeniz,Türk,Ortadoğu","Akdeniz, Türk, Ortadoğu",679,+90 212 458 59 19,187-187,4.5,"Vejetaryen Dostu, Glütensiz Seçenekler",187.0,187.0
Safran Restoran,"Asker Ocağı Cad. No: 1 Taksim, İstanbul 34435 Türkiye,İnternet sitesi,Menü","Türk,Helal",Helal,173,+90 212 368 44 44,,4.5,"Akşam Yemeği, İçecekler",187.0,187.0
Cafe Rumist,"Sultan Ahmet Mahallesi, Akbıyık Cad. No: 5 Fatih, İstanbul Türkiye,İnternet sitesi","Kafe,Akdeniz,Avrupa,Türk","Kafe, Akdeniz, Avrupa, Türk, Sağlıklı, Ortadoğu",2159,+90 212 458 66 41,92-277,4.5,"Vejetaryen Dostu, Vegan Seçenekleri, Helal, Kosher, Glütensiz Seçenekler",184.5,184.5
Peymane Ocakbaşı,"Sinanpasa Mahallesi, Alaybeyi Sokak No: 7/A Tophane, İstanbul Türkiye,İnternet sitesi","Akdeniz,Barbekü,Türk","Akdeniz, Barbekü, Türk, Ortadoğu",499,+90 212 293 31 36,71-284,4.5,"Vejetaryen Dostu, Helal, Glütensiz Seçenekler",177.5,177.5
Mercado,"Osmanağa mah. Özpark çikmazi sokak no:6A Kadiköy Kadiköy, İstanbul 34714 Türkiye,İnternet sitesi","Deniz Mahsülleri,Fast Food,Akdeniz","Deniz Mahsülleri, Fast Food, Akdeniz, İspanyol, Ortadoğu, İran",90,+90 216 325 23 01,71-284,4.5,Brunch,177.5,177.5
Aheste,"Asmalı Mescit Mah.  Meşrutiyet Cad. No: 107/F Beyoğlu, İstanbul 34430 Türkiye,İnternet sitesi,Menü","Akdeniz,Türk,Sağlıklı","Akdeniz, Türk, Sağlıklı, Ortadoğu",439,+90 212 243 26 33,106-248,4.5,"Vejetaryen Dostu, Vegan Seçenekleri, Glütensiz Seçenekler",177.0,177.0
St. Regis Brasserie,"Mim Kemal Öke Cad No: 35 Located at The St. Regis Istanbul, İstanbul 34367 Türkiye,İnternet sitesi,Menü","Uluslararası,Vejetaryen Dostu",Uluslararası,108,+90 212 368 08 36,100-250,4.5,Vejetaryen Dostu,175.0,175.0
Sultan Köşesi,"Küçükayasofya Caddesi No:6 Sultanahmet, İstanbul 34122 Türkiye,İnternet sitesi","Akdeniz,Türk,Ortadoğu","Akdeniz, Türk, Ortadoğu",346,+90 212 516 66 06,119-230,4.5,"Vejetaryen Dostu, Vegan Seçenekleri, Helal",174.5,174.5
4ten4e Ocakbaşı,"Tomtom Mah. Yeniçarşı Cad. No: 38 Beyoğlu, Kat 1, İstanbul 34433 Türkiye,İnternet sitesi,Menü","Barbekü,Türk,Ortadoğu","Türk, Barbekü, Ortadoğu",26,+90 212 251 74 91,99-249,4.5,"Akşam Yemeği, İçecekler",174.0,174.0
F&B Culture,"Bereketzade Mah. Camekan Sokak No: 6 Beyoğlu, İstanbul 34343 Türkiye,İnternet sitesi,Menü","Türk,Sağlıklı,Vejetaryen Dostu","Türk, Sağlıklı",422,+90 532 275 69 94,40-300,4.5,"Vejetaryen Dostu, Vegan Seçenekleri, Glütensiz Seçenekler",170.0,170.0
Elbet Steakhouse,"Acıbadem Mahallesi, Çeçen Sokak, No:25 Akasya Avm, İstanbul 34660 Türkiye,İnternet sitesi,Menü","Biftek Restoranı,Barbekü,Türk","Türk, Biftek Restoranı, Barbekü",8,+90 216 514 55 34,36-300,4.5,"Kahvaltı, Öğle Yemeği, Akşam Yemeği, İçecekler",168.0,168.0
Adora Restaurant,"Hüdavendigar Caddesi, Erdoğan Sok. No: 14 - 16 Gülhane, Hotel Adora, İstanbul 34110 Türkiye,İnternet sitesi","Akdeniz,Avrupa,Türk","Akdeniz, Avrupa, Türk, Ortadoğu",531,+90 212 527 49 49,34-298,4.5,"Vejetaryen Dostu, Vegan Seçenekleri, Helal, Glütensiz Seçenekler",166.0,166.0
Güverte Cafe,"Moda Cad. Ferit Tek Sok. Kaçkar Apt. No:21/A Moda, Kadıköy, İstanbul Türkiye,İnternet sitesi",Uluslararası,"Öğle Yemeği, Akşam Yemeği",15,3308929,,4.5,Rezervasyonlar,164.0,164.0
Sultania Restaurant,"Ebusuud Caddesi, Mehmet Murat Sokak No: 4 Sirkeci, İstanbul 34110 Türkiye,İnternet sitesi","Akdeniz,Avrupa,Türk","Akdeniz, Avrupa, Türk",314,+90 212 528 13 42,68-255,4.5,"Vejetaryen Dostu, Vegan Seçenekleri, Glütensiz Seçenekler",161.5,161.5
KumSaati Jazz Blues ,"Asmalımescid Mah.Jurnal Sok.No:17 Beyoğlu, İstanbul 34430 Türkiye,İnternet sitesi","Bar,Uluslararası,Bar","Bar, Uluslararası, Bar",541,+90 212 245 72 73,106-213,4.5,"Öğle Yemeği, Akşam Yemeği, Gece Eğlencesi, İçecekler",159.5,159.5
HG Ev Yemekleri,"Ataşehir Bulvarı, Atatürk Mahallesi, Ata3/4 Blok No: 52 38 Ada, İstanbul 34758 Türkiye,İnternet sitesi","Türk,Sağlıklı","Öğle Yemeği, Akşam Yemeği",4,+90 216 548 14 62,,4.5,"Paket Yemek, Açık Havada Oturma, Açık Büfe, Cadde Üzerinde Park, Ücretsiz Wifi",157.5,157.5
Grillo Restaurant & Bar,"Cemal Sahir Sokak 7-9, Mecidiyekoy Rönesansbiz binası, İstanbul 34387 Türkiye,İnternet sitesi","İtalyan,Lübnan,Akdeniz","İtalyan, Lübnan, Akdeniz, Türk",94,+90 212 266 08 96,28-284,4.5,"Öğle Yemeği, Akşam Yemeği, Kahvaltı",156.0,156.0
Aşkana,"Ahmet Adnan Saygun Cd. Metehan Sk. No: 1/1 2. Ulus, Etiler, Türkel Apt., İstanbul 34337 Türkiye,İnternet sitesi,Menü","Türk,Helal",Türk,38,+90 212 268 74 42,21-284,4.5,Helal,152.5,152.5
Ayık 24,"Caferağa Mahallesi, Dumlupınar Sokak No: 14/A Kadıköy, İstanbul 34710 Türkiye,İnternet sitesi","Fast Food,Türk,Çorbalar",Helal,46,+90 216 337 36 62,,4.5,"Öğle Yemeği, Akşam Yemeği",150.0,150.0
Baazen Tantuni,"Bahçelievler Mah. Fırat Selim Paşa Cad. No: 1/A Bahçelievler Merkez, İstanbul 34180 Türkiye,İnternet sitesi,Menü",Türk,"Öğle Yemeği, Akşam Yemeği",45,+90 212 441 44 00,,4.5,"Dışarı Yemek Servisi, Oturma, Masaya Servis",150.0,150.0
Guler Osmanli Mutfagi,"Hasanpasa Mah. Kurbagali Dere Cad. No:74/A Kadıkoy, İstanbul Türkiye,İnternet sitesi",Türk,"Öğle Yemeği, Kahvaltı, Akşam Yemeği",29,3482245,,4.5,Rezervasyonlar,150.0,150.0
