titleRestaurant,adress,information,kitchens,number_of_comments,phoneNumber,price,score,special_types_of_diets,average_price,price_min
Queen's Chips AMSTERDAM,"Asmalimescit Sk, İstanbul 34420 Türkiye,İnternet sitesi,Menü","Felemenk,Fast Food,Uluslararası","Felemenk, Fast Food, Uluslararası, Avrupa",2,+90 530 515 10 90,15-36,4.5,"Kahvaltı, Öğle Yemeği, Akşam Yemeği, Brunch, Gece Eğlencesi, İçecekler",25.5,25.5
Arden Terrace Restaurant,"Alemdar Mh. Kazım İsmail Gürkan Cad. No: 2 Sultanahmet, Arden City Hotel, İstanbul 34110 Türkiye,İnternet sitesi","Avrupa,Türk","Öğle Yemeği, Akşam Yemeği",502,+90 212 528 93 93,,4.5,"Rezervasyonlar, Açık Havada Oturma, Oturma, Alkol Var, Bebek Sandalyesi Var, Masaya Servis",25.0,25.0
TATBAK,"Vali Konagi Cad. Ak Kavak Sok. No:38/A Tesvikiye, Sisli, İstanbul 34365 Türkiye,İnternet sitesi,Menü","Türk,Helal",Türk,139,+90 212 248 04 25,15-35,4.5,Helal,25.0,25.0
Karachi Darbar pakistan restaurant,"Cihangir, Sıraselviler Cd. No:31 D:A1, İstanbul 34433 Türkiye,İnternet sitesi,Menü","Hint,Asya,Pakistan","Hint, Pakistan, Asya, Bangladeş",22,+90 532 012 31 30,10-40,4.5,Helal,25.0,25.0
Mim Kahve,"Demirtaş Mah. Devoğlu Sk. No:10, İstanbul Türkiye,İnternet sitesi,Menü","Fast Food,Türk","Fast Food, Türk",14,+90 212 511 88 56,14-35,4.5,"Kahvaltı, Öğle Yemeği, Akşam Yemeği, Brunch, İçecekler",24.5,24.5
Darüssaade,"Akbıyık Cad. No: 90 Sultanahmet, İstanbul 34122 Türkiye,İnternet sitesi","Akdeniz,Avrupa,Türk","Avrupa, Türk, Akdeniz",74,+90 212 518 36 36,8-40,4.5,Helal,24.0,24.0
Mehmet Emin Ciğer Kebap,"Dilek Sabancı Cad. No: 10 Küçükbakkalköy, Ataşehir, İstanbul 34750 Türkiye,İnternet sitesi",Türk,Türk,13,+90 216 565 36 36,15-33,4.5,"Öğle Yemeği, Akşam Yemeği",24.0,24.0
Dürümzade,"Kamerhatun Cad. Çekenler Sok. No: 26/A Huseyinaga Mah., İstanbul 34435 Türkiye,İnternet sitesi","Fast Food,Barbekü,Türk","Fast Food, Barbekü, Türk, Mangal, Sağlıklı, Çorbalar",678,+90 212 249 01 47,15-30,4.5,Helal,22.5,22.5
Proje Cafe,"Lüleci Hendek Cd. 22a Hacımimi Mahallesi, İstanbul 34425 Türkiye,İnternet sitesi","İtalyan,Kafe,Türk","Kafe, Türk, İtalyan, Kuzey İtalya, Orta İtalya",17,+90 212 243 82 39,10-35,4.5,"Kahvaltı, Öğle Yemeği, Brunch, İçecekler",22.5,22.5
Shozy Cafe,"Beşyol Mh. Eski Londra Asfaltı No: 8, İstanbul Türkiye,İnternet sitesi,Menü","İtalyan,Fransız,Meksika","Türk, İtalyan, Fransız, Meksika",5,+90 212 649 93 02,7-38,4.5,"Brunch, İçecekler, Kahvaltı, Öğle Yemeği, Akşam Yemeği",22.5,22.5
Pop’s Balat,"Ayan Cad. No:62 Balat Mahallesi, İstanbul 34087 Türkiye,İnternet sitesi",no input,"Kahvaltı, Öğle Yemeği, Akşam Yemeği, İçecekler",49,+90 535 445 45 16,14-30,4.5,"Paket Yemek, Oturma, Cadde Üzerinde Park, Bebek Sandalyesi Var, Ücretsiz Wifi, Kredi Kartı Geçerli, Masaya Servis, Köpek Dostu, Sigara içilmeyen restoranlar",22.0,22.0
Kadıköy Çorbacısı,"Osmanağa Mah. Kırtasiyeci Sok. No: 44-B Kadıköy, İstanbul 34714 Türkiye,İnternet sitesi,Menü","Türk,Lokanta,Çorbalar","Türk, Çorbalar, Lokanta",7,+90 216 337 07 93,7-36,4.5,"Brunch, İçecekler, Kahvaltı, Öğle Yemeği, Akşam Yemeği",21.5,21.5
Üsküdar Park Cafe & Restaurant,"Kirazlıtepe mahallesi Orhan Seyfi Orhon Caddesi No:33 Şenol Güneş Parkı, İstanbul 34682 Türkiye,İnternet sitesi,Menü","Amerikan,Pizza,Fast Food","Amerikan, Pizza, Fast Food, Türk",50,+90 216 310 10 06,12-30,4.5,"Kahvaltı, Öğle Yemeği, Akşam Yemeği, Brunch, İçecekler",21.0,21.0
Antiochia Concept,"Asmalımescit Mah. General Yazgan Sok. No: 3 Beyoğlu, İstanbul Türkiye,İnternet sitesi","Akdeniz,Türk,Ortadoğu","Vejetaryen Dostu, Vegan Seçenekleri, Glütensiz Seçenekler",642,+90 212 244 08 20,,4.5,"Öğle Yemeği, Akşam Yemeği, Gece Eğlencesi",20.0,20.0
Blu Kitchen,"Hüdavendigar Cd. No: 5 Blu Hotel, İstanbul 34110 Türkiye,İnternet sitesi","Kafe,Akdeniz,Avrupa","Vejetaryen Dostu, Vegan Seçenekleri, Helal, Kosher, Glütensiz Seçenekler",436,+90 212 514 98 28,,4.5,"Kahvaltı, Öğle Yemeği, Akşam Yemeği, Brunch, Gece Eğlencesi",20.0,20.0
Keyf-i Mekan Cafe And Restaurant,"Tığcılar Sokak No: 48 Kapalıçarsı / Mercan, İstanbul Türkiye,İnternet sitesi","Uluslararası,Türk","Uluslararası, Türk",429,+90 212 522 58 61,8-32,4.5,"Kahvaltı, Öğle Yemeği, Akşam Yemeği, Gece Eğlencesi",20.0,20.0
Tie Break Cafe,"Acarlar Mahallesi, 3. Kısım, 9. Cadde No: 2 Beykoz, Acarkent Sitesi, İstanbul Türkiye,İnternet sitesi",Avrupa,Avrupa,3,+90 216 875 07 86,10-30,4.5,"Brunch, İçecekler, Kahvaltı, Öğle Yemeği, Akşam Yemeği",20.0,20.0
Pera Center Hotel Roof Restaurant,"Katip Mustafa Celebi Mah. Billurcu Sokak No 14, İstanbul 34433 Türkiye,İnternet sitesi","Deniz Mahsülleri,Uluslararası,Akdeniz","Deniz Mahsülleri, Akdeniz, Ortadoğu, Uluslararası, Türk",58,+90 212 292 38 92,8-30,4.5,"Kahvaltı, Öğle Yemeği, Akşam Yemeği, Brunch, Gece Eğlencesi, İçecekler",19.0,19.0
Hammur,"Merdivenköy Mah. Ressam Salih Ermez Cad. No: 40/A Göztepe - Kadıköy, İstanbul 34732 Türkiye,İnternet sitesi","Fast Food,Türk,Kafkas","Fast Food, Kafkas, Türk",7,+90 216 566 66 65,8-28,4.5,"Öğle Yemeği, Akşam Yemeği, Brunch, İçecekler, Kahvaltı",18.0,18.0
Cafe Berry,"Ömer Hayyam Caddesi No: 22 Beyoğlu Kalyoncu Kulluğu Mahallesi, İstanbul 34070 Türkiye,İnternet sitesi,Menü","Amerikan,Kafe,Avrupa","Amerikan, İngiliz, Türk, Kafe, Avrupa",5,+90 554 299 46 89,6-30,4.5,"Kahvaltı, Öğle Yemeği, Brunch, İçecekler",18.0,18.0
Mam 1585,"Hoca Rustem Sokak No:2, İstanbul 34122 Türkiye,İnternet sitesi","Tatlı,Kafe,Arjantin","Kafe, Arjantin",199,+90 532 223 54 23,5-30,4.5,Kahvaltı,17.5,17.5
Ciğer Ricco,"Ebuziya Cd. Ömernaci Sk. No: 20/A Bakırköy, Ermeni Kilisesi Arkası, İstanbul 34140 Türkiye,İnternet sitesi,Menü",Türk,Türk,23,+90 212 583 78 55,10-25,4.5,"Öğle Yemeği, Kahvaltı, Akşam Yemeği",17.5,17.5
Afyon Sucuk Evi,"Seyit Onbası Sok. No:9/B Kurtkoy Mah., İstanbul 34912 Türkiye,İnternet sitesi",Fast Food,Fast Food,2,+90 216 606 28 38,10-25,4.5,"Kahvaltı, Öğle Yemeği, Akşam Yemeği",17.5,17.5
Burger Ye,"Bulgurlu Cad. Sarıçiçek Sok. No: 1/A Üsküdar, İstanbul 34696 Türkiye,İnternet sitesi,Menü","Amerikan,Fast Food","Amerikan, Fast Food",2,+90 216 321 62 62,10-25,4.5,"Kahvaltı, Öğle Yemeği, Akşam Yemeği, Brunch",17.5,17.5
Serez Dondurmacısı,"Altayçeşme Mah, Begonya Sok, No 47/B, İstanbul Türkiye,İnternet sitesi,Menü",no input,"Gece Eğlencesi, İçecekler",35,+90 850 259 7374,4-30,4.5,"Oturma, Paket Yemek, Açık Havada Oturma, Cadde Üzerinde Park, Ücretsiz Yol Üstü Olmayan Park Yeri, Bebek Sandalyesi Var, Tekerlekli Sandalye İle Erişim, Kredi Kartı Geçerli",17.0,17.0
Hoca Pasa Pidecisi,"Hoca Pasa sk 19, İstanbul Türkiye,İnternet sitesi","Türk,Vejetaryen Dostu,Helal","Vejetaryen Dostu, Helal",365,5120990,,4.5,"Öğle Yemeği, Akşam Yemeği",16.5,16.5
Aret'in Yeri,"Hüseyin Ağa Mah. Balıkpazarı Kameriye Sk. No: 9 Beyoğlu, Nevizade, İstanbul 34435 Türkiye,İnternet sitesi","Akdeniz,Türk,Yunan","Vejetaryen Dostu, Vegan Seçenekleri, Glütensiz Seçenekler",292,+90 212 292 10 10,,4.5,"Öğle Yemeği, Akşam Yemeği, Gece Eğlencesi",16.5,16.5
Books & Coffee Caddebostan,"Vezir Sokak, No: 4A/1 Caddebostan Mah., İstanbul 34728 Türkiye,İnternet sitesi",Kafe,Kafe,10,+90 216 411 22 33,3-30,4.5,"Kahvaltı, Öğle Yemeği, Akşam Yemeği, Brunch, İçecekler",16.5,16.5
Pide Maide,"Gayrettepe Mah. Yıldız Posta Cad. No: 28/c Ay Yıldız Pasajı, İstanbul 34349 Türkiye,İnternet sitesi",Türk,Türk,15,+90 212 356 57 67,12-20,4.5,"Öğle Yemeği, Akşam Yemeği",16.0,16.0
Sahrap Restaurant,"General Yazgan Sokak, No:13A Asmali Mescit, İstanbul 34430 Türkiye,İnternet sitesi,Menü","Türk,Vejetaryen Dostu,Vegan Seçenekleri",Türk,321,+90 212 243 16 16,4-24,4.5,"Vejetaryen Dostu, Vegan Seçenekleri, Helal, Glütensiz Seçenekler",14.0,14.0
English Cake Factory,"Nisbetiye Caddesi Profesorler Sitesi c2 Blok No:124, İstanbul 34337 Türkiye,İnternet sitesi",Kafe,Kafe,10,+90 212 288 26 99,6-22,4.5,Kahvaltı,14.0,14.0
Tarihi Eminönü Dürümcüsü,"Hobyar Mahallesi, Büyük Postane Caddesi, No:14/B No:14/b Sirkeci, İstanbul 34112 Türkiye,İnternet sitesi","Barbekü,Türk,Vejetaryen Dostu","Türk, Barbekü",718,+90 212 511 00 40,9-18,4.5,"Vejetaryen Dostu, Helal",13.5,13.5
Mr Cook Cafe & Restaurant,"Molla Feneri Sok. No:39 Cağaloğlu, Fatih, İstanbul 34110 Türkiye,İnternet sitesi","Türk,Vejetaryen Dostu,Vegan Seçenekleri",Türk,1170,+90 212 512 92 04,5-20,4.5,"Vejetaryen Dostu, Vegan Seçenekleri, Helal, Glütensiz Seçenekler",12.5,12.5
Kebapci Murat,"Topkapı Mahallesi, Topkapı Caddesi, No:19, Topkapı, Fatih, İstanbul 34093 Türkiye,İnternet sitesi,Menü",Türk,"Akşam Yemeği, Öğle Yemeği",93,+90 212 523 01 01,,4.5,"Paket Yemek, Tekerlekli Sandalye İle Erişim, Masaya Servis, Rezervasyonlar, Oturma",12.5,12.5
Kurtköy Çiğ Börek ve Mantı Evi,"Kurtköy Mahallesi, Yeniçeri Sokak No: 15, İstanbul Türkiye,İnternet sitesi,Menü","Türk,Rus","Türk, Rus",25,+90 533 280 98 06,5-20,4.5,"Kahvaltı, Öğle Yemeği, Akşam Yemeği, Brunch, Gece Eğlencesi, İçecekler",12.5,12.5
TOI Restaurant & Lounge,"Kuruçeşme Caddesi No: 11 Kuruçeşme, İstanbul 34345 Türkiye,İnternet sitesi,Menü","Türk,Vejetaryen Dostu,Vegan Seçenekleri","Vejetaryen Dostu, Vegan Seçenekleri",711,+90 212 258 00 29,,4.5,"Akşam Yemeği, Gece Eğlencesi, İçecekler",12.0,12.0
Akın Restoran,"Emekyemez Mahallesi, Tersane Caddesi No: 120/A, İstanbul 34421 Türkiye,İnternet sitesi,Menü","Akdeniz,Türk,Vejetaryen Dostu","Türk, Akdeniz",436,+90 212 256 00 07,6-18,4.5,"Vejetaryen Dostu, Vegan Seçenekleri",12.0,12.0
Tantuni Sofrası,"Büyükdere Caddesi, No:127 Esentepe Astoria AVM, İstanbul 34394 Türkiye,İnternet sitesi,Menü","Fast Food,Türk,Çorbalar","Çorbalar, Fast Food, Türk",3,+90 850 840 3355,8-13,4.5,"Öğle Yemeği, Akşam Yemeği, Brunch, Gece Eğlencesi, İçecekler",10.5,10.5
Palmiye Restaurant Istanbul,"Alemdar Mah Incili Çavuş Sok No 35 Sultanahmet, İstanbul 34110 Türkiye,İnternet sitesi","Akdeniz,Türk,Helal","Türk, Akdeniz",240,+90 212 527 64 76,5-15,4.5,Helal,10.0,10.0
Summit Restaurant,"Gökevler Mah. 2317. Sk. No: 1 Kaya İstanbul Fair & Convention, Esenyurt, İstanbul 34522 Türkiye,İnternet sitesi","Uluslararası,Akdeniz,Türk","İçecekler, Akşam Yemeği",60,+90 212 866 23 23,,4.5,"Rezervasyonlar, Oturma, Otopark Var, Bebek Sandalyesi Var, Tekerlekli Sandalye İle Erişim, Alkol Var, Tüm İçkiler, Ücretsiz Wifi, Masaya Servis",10.0,10.0
Seventeen Pizza,"Şelale Cad. Akın Sok. No: 1 M Bahçeşehir, Başakşehir, İstanbul 34488 Türkiye,İnternet sitesi,Menü","Pizza,Vejetaryen Dostu",Pizza,41,+90 212 553 17 17,10-10,4.5,Vejetaryen Dostu,10.0,10.0
Admira Cafe,"Deftardar Yokusu no 53/A, İstanbul 34425 Türkiye,İnternet sitesi,Menü","İtalyan,Amerikan,Akdeniz","İtalyan, Amerikan, Akdeniz, İngiliz, Türk",32,+90 212 972 19 66,4-15,4.5,Akşam Yemeği,9.5,9.5
Sultanahmet Fish House,"Prof. K. İsmail Gürkan Caddesi No: 14 Sultanahmet, İstanbul 34400 Türkiye,İnternet sitesi","Deniz Mahsülleri,Akdeniz,Türk","Vejetaryen Dostu, Vegan Seçenekleri, Helal, Glütensiz Seçenekler",1950,+90 541 859 89 50,,4.5,"Öğle Yemeği, Akşam Yemeği, Gece Eğlencesi",8.5,8.5
Velvet Cafe,"Bereketzade M Kule Cikmazi 7A Beyoglu, İstanbul 34000 Türkiye,İnternet sitesi","Kafe,Türk,Vejetaryen Dostu","Kafe, Türk",400,+90 543 331 33 39,3-14,4.5,"Vejetaryen Dostu, Vegan Seçenekleri, Helal, Glütensiz Seçenekler",8.5,8.5
Olivia's Pizzeria,"Bağdat Cad. No:215 Çiftehavuzlar, Kadıköy, İstanbul Türkiye,İnternet sitesi","Pizza,Vejetaryen Dostu",Vejetaryen Dostu,105,3552438,,4.5,"Öğle Yemeği, Akşam Yemeği",7.0,7.0
bop! Breakfast of Pan,"Rasimpaşa Mahallesi, Duatepe Sok. No: 4/D Kadıköy, İstanbul 34716 Türkiye,İnternet sitesi","Akdeniz,Türk","Türk, Akdeniz",70,+90 216 700 10 86,3-11,4.5,"Kahvaltı, İçecekler, Brunch, Öğle Yemeği, Akşam Yemeği",7.0,7.0
Megara Palace,"Ishakpasa Cad. 8, İstanbul 34140 Türkiye,İnternet sitesi",Türk,"Kahvaltı, Öğle Yemeği, Akşam Yemeği",26,+90 212 518 36 56,,4.5,Oturma,5.5,5.5
Galapagos Restoran,"İstanbul Caddesi No: 35 Florya, İstanbul 34153 Türkiye,İnternet sitesi,Menü","Deniz Mahsülleri,Uluslararası,Akdeniz","Deniz Mahsülleri, Uluslararası, Akdeniz, Barbekü, Türk",553,+90 542 251 72 54,2-7,4.5,"Öğle Yemeği, Akşam Yemeği, Gece Eğlencesi",4.5,4.5
Seviç Restoran,"İstiklal Caddesi Çiçek Pasajı No: 80-8 Beyoğlu, İstanbul 34435 Türkiye,İnternet sitesi,Menü","Akdeniz,Türk","Öğle Yemeği, Akşam Yemeği, Gece Eğlencesi, İçecekler",61,+90 212 244 28 67,,4.0,"Rezervasyonlar, Oturma, Alkol Var, Açık Havada Oturma, Tekerlekli Sandalye İle Erişim, Masaya Servis",4857.0,4857.0
Kalamis Paysage Restaurant,"Münir Nurettin Selçuk Cad. Kadıköy, Kalamış Yat Limanı İçi, İstanbul 34726 Türkiye,İnternet sitesi","Deniz Mahsülleri,Akdeniz,Türk","Akdeniz, Türk, Deniz Mahsülleri, Şarap Barı",23,+90 216 337 44 44,709-2127,4.0,"Kahvaltı, Brunch, Gece Eğlencesi, İçecekler, Öğle Yemeği, Akşam Yemeği",1418.0,1418.0
Gunaydin,"Swissotel Bosphorus Bayildim Cad. No.2, İstanbul 34357 Türkiye,İnternet sitesi,Menü","Biftek Restoranı,Barbekü,Türk","Biftek Restoranı, Türk, Barbekü",97,+90 212 258 12 03,425-1418,4.0,Helal,921.5,921.5
The North Shield Pub,"Cami Mah. Balıkçılar Sk. No: 20/C-70 Tuzla, İstanbul 34940 Türkiye,İnternet sitesi","Bar,Bar,Gastropub","Bar, Bar, Gastropub",37,+90 216 504 33 00,425-1418,4.0,"Öğle Yemeği, Akşam Yemeği, Gece Eğlencesi, İçecekler",921.5,921.5
Park Şamdan,"Muallim Naci Cad. Reina Night Club No:44 Ortaköy, Beşiktaş, İstanbul Türkiye,İnternet sitesi","Uluslararası,Türk",Akşam Yemeği,15,3270867,,4.0,Rezervasyonlar,921.5,921.5
Galata Balık,"Galata Köprüsü Altı-Boğaz Tarafı Eminönü, İstanbul 34500 Türkiye,İnternet sitesi,Menü","Deniz Mahsülleri,Akdeniz,Avrupa",Vejetaryen Dostu,216,+90 212 528 95 43,,4.0,"Öğle Yemeği, Akşam Yemeği, Kahvaltı",886.5,886.5
Nalia Karadeniz Mutfağı,"Bağlar Mah. Yalçın Koreş Cad. No:2 D:3 Bağcılar Güneşli, İstanbul 34212 Türkiye,İnternet sitesi,Menü","Türk,Vejetaryen Dostu,Helal","Vejetaryen Dostu, Helal",113,+90 212 630 06 90,,4.0,"Kahvaltı, Öğle Yemeği, Akşam Yemeği, Brunch",886.5,886.5
Namlı Kebap,"Levent Mahallesi, Nispetiye Caddesi, Gonca Sokak No: 3 Beşiktaş, İstanbul 34330 Türkiye,İnternet sitesi","Barbekü,Türk,Helal","Türk, Barbekü",101,+90 212 284 52 94,355-1418,4.0,Helal,886.5,886.5
Hatay Medeniyetler Sofrası,"Horhor Caddesi No: 49 Aksaray / İSTANBUL, İstanbul 34096 Türkiye,İnternet sitesi,Menü","Akdeniz,Barbekü,Türk","Akdeniz, Barbekü, Türk, Ortadoğu",483,+90 212 523 31 31,213-1418,4.0,Helal,815.5,815.5
Pasha Cafe & Pub,"Divan Yolu Cad. No 64 Sultanahmet - Fatih, İstanbul 34425 Türkiye,İnternet sitesi,Menü","Uluslararası,Avrupa,Türk","Öğle Yemeği, Brunch, Akşam Yemeği, Gece Eğlencesi",264,+90 212 514 29 31,,4.0,"Rezervasyonlar, Açık Havada Oturma, Oturma, Televizyon, Tekerlekli Sandalye İle Erişim, Alkol Var, Tüm İçkiler, Ücretsiz Wifi, Masaya Servis",815.5,815.5
Nergis Balık Restaurant,"Eminönü, Yeni Galata Köprüsü Altı, İstanbul 34850 Türkiye,İnternet sitesi,Menü","Bar,Deniz Mahsülleri,Akdeniz","Deniz Mahsülleri, Akdeniz, Türk, Bar",1753,+90 541 528 92 48,532-1064,4.0,"Vejetaryen Dostu, Vegan Seçenekleri, Glütensiz Seçenekler",798.0,798.0
Nalia,"İçerenköy Mah. Prof. Dr. Ali Nihat Tarlan Cad. No:103 D:1 Kadıköy Bostancı, İstanbul Türkiye,İnternet sitesi,Menü","Türk,Vejetaryen Dostu",Vejetaryen Dostu,233,4699610,,4.0,"Kahvaltı, Öğle Yemeği, Akşam Yemeği",798.0,798.0
AKO Ahmet Usta Islama Köftecisi,"Yasa Cad. No: 11 Kadıköy, İstanbul Türkiye,İnternet sitesi",Türk,Öğle Yemeği,81,+90 216 338 78 15,,4.0,Paket Yemek,798.0,798.0
Ismet Baba Restaurant,"Carsi Caddesi No. 1/A, İstanbul Türkiye,İnternet sitesi","Deniz Mahsülleri,Akdeniz,Türk","Öğle Yemeği, Akşam Yemeği",59,+90 216 553 12 32,,4.0,"Rezervasyonlar, Alkol Var, Masaya Servis",798.0,798.0
Sunset Grill & Bar,"Kurucesme Mahallesi Yol Sokak No:2 Ulus Park Cafe & Panorama, İstanbul 34345 Türkiye,İnternet sitesi,Menü","Uluslararası,Suşi,Füzyon","Suşi, Uluslararası, Füzyon",1283,+90 212 287 03 57,496-1064,4.0,"Vejetaryen Dostu, Vegan Seçenekleri, Glütensiz Seçenekler",780.0,780.0
Şazeli Florya,"Şenlikköy Mahallesi, Halkalı Caddesi, No:10 Florya, Bakırköy, İstanbul 34153 Türkiye,İnternet sitesi","Biftek Restoranı,Barbekü,Şarküteri","Biftek Restoranı, Barbekü, Şarküteri",385,+90 212 547 01 01,71-1418,4.0,Helal,744.5,744.5
Çiya Sofrası,"Caferağa Mah. Güneşlibahçe Sk. No: 43 Kadıköy, İstanbul Türkiye,İnternet sitesi,Menü","Türk,Ortadoğu,Vejetaryen Dostu","Vejetaryen Dostu, Vegan Seçenekleri, Helal",286,+90 216 330 31 90,,4.0,"Akşam Yemeği, Öğle Yemeği",737.5,737.5
Therapia Balık,"Tarabya Mah. Haydar Aliyev Cad. No:96/B Sarıyer, İstanbul 34420 Türkiye,İnternet sitesi,Menü","Deniz Mahsülleri,Akdeniz,Türk","Deniz Mahsülleri, Türk, Akdeniz",69,+90 212 223 25 26,532-922,4.0,"Öğle Yemeği, Akşam Yemeği, İçecekler",727.0,727.0
Kilimanjaro,"Birahane Sokak No:1 Şişli, Bomonti Bira Fabrikası İçinde, İstanbul 34377 Türkiye,İnternet sitesi,Menü","Avrupa,Türk,Vegan Seçenekleri","Avrupa, Türk",83,+90 212 225 39 80,355-1064,4.0,Vegan Seçenekleri,709.5,709.5
Elbet Steakhouse,"Akat Mahallesi, Zeytinoğlu Cad. Yaren Sokak No: 6/21 Beşiktaş, İstanbul 34335 Türkiye,İnternet sitesi,Menü","Biftek Restoranı,Barbekü,Türk","Arjantin, Biftek Restoranı, Barbekü, Türk",132,+90 212 351 03 44,284-1064,4.0,"Akşam Yemeği, İçecekler",674.0,674.0
Park Fora Balık ve Deniz Ürünleri Restaurantı,"Muallim Naci Cad. No: 54/A Beşiktaş, Cemil Topuzlu Parkı İçi, İstanbul 80840 Türkiye,İnternet sitesi,Menü",Vejetaryen Dostu,Vejetaryen Dostu,531,+90 212 265 50 63,496-851,4.0,"Öğle Yemeği, Akşam Yemeği",673.5,673.5
Develi,"Münir Nurettin Selçuk Caddesi Kalamış Yat Limanı Kadıköy, İstanbul Türkiye,İnternet sitesi,Menü","Barbekü,Türk,Helal",Helal,344,+90 216 418 94 00,,4.0,"Öğle Yemeği, Akşam Yemeği, Gece Eğlencesi",620.5,620.5
Huzur Bahçesi,"Demirkapı Cad. No: 21 Paşamandra Köyü, Riva, Beykoz, İstanbul 34829 Türkiye,İnternet sitesi","Biftek Restoranı,Türk,Mangal","Biftek Restoranı, Türk, Mangal, Sağlıklı",32,+90 532 623 53 39,177-1064,4.0,"Brunch, Gece Eğlencesi, İçecekler, Kahvaltı, Öğle Yemeği, Akşam Yemeği",620.5,620.5
Mekan,"Tomtom Mah. İstiklal Cad. Eski Çiçekçi Sok. No:3 Cihangir, İstanbul Türkiye,İnternet sitesi","Akdeniz,Türk","Türk, Akdeniz",45,2526052,213-993,4.0,"Akşam Yemeği, Kahvaltı, Öğle Yemeği, Gece Eğlencesi",603.0,603.0
Kız Kulesi ,"Uskudar, Istanbul, Turkiye, İstanbul Türkiye,İnternet sitesi,Menü","Türk,Vejetaryen Dostu",Türk,402,+90 216 342 47 47,496-709,4.0,Vejetaryen Dostu,602.5,602.5
Nomads Restaurant,"Cetin Emec Blv,  Bostan tuccarı Sok. No:2/1 Ortaköy, Beşiktaş, İstanbul 34744 Türkiye,İnternet sitesi,Menü","Lübnan,Türk,Ortadoğu",Helal,137,+90 216 658 62 79,,4.0,"Akşam Yemeği, Gece Eğlencesi",602.5,602.5
Frankie İstanbul,"Tesvikiye Caddesi No: 41-41 A Nişantaşı Sofa Otel Çatı Katı, İstanbul 34367 Türkiye,İnternet sitesi,Menü","Uluslararası,Akdeniz,Avrupa","Uluslararası, Akdeniz, Avrupa",128,+90 212 230 66 66,284-886,4.0,Vegan Seçenekleri,585.0,585.0
Galata Konak Cafe,"Hacı Ali Sok. No:2 Bereketzade Mahallesi, İstanbul 34425 Türkiye,İnternet sitesi,Menü","Kafe,Türk,Vejetaryen Dostu",Vejetaryen Dostu,110,+90 212 252 53 46,,4.0,"Kahvaltı, Öğle Yemeği, Brunch, İçecekler",585.0,585.0
Hamdi Restaurant,"Tahmis Cad Kalcin Sok No.17 Eminonu, İstanbul 34116 Türkiye,İnternet sitesi,Menü","Akdeniz,Türk,Ortadoğu","Vejetaryen Dostu, Vegan Seçenekleri, Helal, Glütensiz Seçenekler",4289,+90 444 6 463,,4.0,"Öğle Yemeği, Akşam Yemeği, Gece Eğlencesi, İçecekler",567.5,567.5
Lacivert Restaurant,"Korfez Cad. 57/A, İstanbul Türkiye,İnternet sitesi,Menü","Deniz Mahsülleri,Akdeniz,Türk","Vejetaryen Dostu, Helal, Glütensiz Seçenekler",587,413 4224,,4.0,"Öğle Yemeği, Akşam Yemeği, Brunch, Gece Eğlencesi",567.5,567.5
Feriye Palace,"Çırağan Cad. No:44 Ortaköy, Beşiktaş, İstanbul 34347 Türkiye,İnternet sitesi,Menü","Akdeniz,Avrupa,Türk","Vejetaryen Dostu, Helal, Glütensiz Seçenekler",469,+90 212 227 22 16,,4.0,"Kahvaltı, Öğle Yemeği, Akşam Yemeği, Brunch, Gece Eğlencesi, İçecekler",567.5,567.5
Lipsos Restaurant,"Beyoglu Balik Pazari Nevizade Kameriye Sok. No. 14, İstanbul Türkiye,İnternet sitesi,Menü","Deniz Mahsülleri,Akdeniz,Türk",Vejetaryen Dostu,84,+90 212 251 02 98,,4.0,"Akşam Yemeği, Öğle Yemeği, Gece Eğlencesi",556.5,556.5
Sıdıka Meze Beşiktaş,"Şari Nedim Caddesi, No:38, İstanbul 34330 Türkiye,İnternet sitesi","Deniz Mahsülleri,Akdeniz,Türk",Vegan Seçenekleri,55,+90 212 259 72 32,,4.0,Akşam Yemeği,556.5,556.5
Liman Lokantasi,"Kemankes Caddesi 48/3 Karakoy Beyoglu, İstanbul 34425 Türkiye,İnternet sitesi",Türk,Türk,131,+90 212 292 39 93,355-709,4.0,"Öğle Yemeği, Akşam Yemeği, Gece Eğlencesi",532.0,532.0
Hacıbaşar Kebap Baklava,"Vedat Günyol cad. No:24  Yolbulan Plaza Ataşehir, İstanbul Türkiye,İnternet sitesi,Menü","Türk,Arap",Kahvaltı,40,+90 216 575 19 55,,4.0,"Paket Yemek, Rezervasyonlar, Kredi Kartı Geçerli, Masaya Servis",532.0,532.0
Bebek Koru Kahvesi,"Bebek Mahallesi, Cevdet Paşa Cd. No: 120 (121)/1 Beşiktaş, İstanbul Türkiye,İnternet sitesi","Kafe,Uluslararası,Akdeniz","Türk, Kafe, Uluslararası, Akdeniz, Avrupa",19,+90 212 287 56 07,213-851,4.0,"Kahvaltı, Öğle Yemeği, Akşam Yemeği",532.0,532.0
Saray Cafe Restaurant,"Yeni Galata Köprüsü No:9 Karaköy, İstanbul 34425 Türkiye,İnternet sitesi","Avrupa,Türk,Vejetaryen Dostu",Vejetaryen Dostu,3,+90 212 243 89 85,,4.0,"Öğle Yemeği, Akşam Yemeği, Kahvaltı",532.0,532.0
Caretta Mediterranean Cuisine,"Esentepe Mahallesi, Keskin Kalem Sokak No: 47 Şişli, İstanbul Türkiye,İnternet sitesi",Akdeniz,Akdeniz,1,+90 212 288 65 93,355-709,4.0,Öğle Yemeği,532.0,532.0
Cemiyet Lokali,"Mollafenari Mahallesi, Türk Ocağı Cd. No: 3 Fatih, İstanbul 34122 Türkiye,İnternet sitesi,Menü",Türk,Türk,1,+90 212 512 36 90,142-886,4.0,"Kahvaltı, Öğle Yemeği, Akşam Yemeği, Brunch, Gece Eğlencesi, İçecekler",514.0,514.0
Mira Balık,"Bebek Arnavutköy Cad. No:70 Beşiktaş, İstanbul Türkiye,İnternet sitesi,Menü","Deniz Mahsülleri,Akdeniz,Türk","Deniz Mahsülleri, Akdeniz, Türk",501,+90 212 265 31 31,106-851,4.0,"Öğle Yemeği, Akşam Yemeği",478.5,478.5
Marmara Kafe,"İstiklal Cad. Büyük Parmak Kapı Sok. No:6 Beyoğlu Merkez, Beyoğlu, İstanbul Türkiye,İnternet sitesi",Fast Food,"Kahvaltı, Öğle Yemeği, Akşam Yemeği",58,2445068,,4.0,"Paket Yemek, Masaya Servis, Açık Havada Oturma, Oturma",478.5,478.5
Nusr-Et Burger Nişantaşı,"Harbiye Mah. Abdi İpekçi Cad. No: 57/A Nişantaşı, Reasürans Pasajı, İstanbul 34000 Türkiye,İnternet sitesi,Menü","Biftek Restoranı,Barbekü,Avrupa","Öğle Yemeği, Akşam Yemeği",974,+90 212 231 24 70,,4.0,"Paket Yemek, Rezervasyonlar, Açık Havada Oturma, Oturma, Alkol Var, Masaya Servis, Bebek Sandalyesi Var",461.0,461.0
Papermoon,"Adnan Saygun Cad. Akmerkez Residence Giriş Kat.No:224 No:224 Akmerkez AVM- Etiler, İstanbul 34337 Türkiye,İnternet sitesi","İtalyan,Akdeniz,Avrupa","İtalyan, Akdeniz, Avrupa",171,+90 212 282 16 16,284-638,4.0,"Vejetaryen Dostu, Vegan Seçenekleri",461.0,461.0
Spago by Wolfgang Puck,"Mim Kemal Öke Cad. No: 35, İstanbul 34367 Türkiye,İnternet sitesi,Menü","Uluslararası,Avrupa,Vejetaryen Dostu","Uluslararası, Avrupa",499,+90 212 368 08 08,400-500,4.0,"Vejetaryen Dostu, Glütensiz Seçenekler",450.0,450.0
Borsa Restaurant,"Vaniköy Caddesi, Sıraevler Sk. No: 12 Üsküdar, Adile Sultan Sarayı, İstanbul Türkiye,İnternet sitesi,Menü","Türk,Helal",Helal,853,+90 216 460 03 05,,4.0,"Öğle Yemeği, Akşam Yemeği",443.0,443.0
Vogue Restaurant,"Akaretler Spor Cad. No:92 BJK Plaza A Blok K:13, İstanbul Türkiye,İnternet sitesi,Menü","Uluslararası,Suşi,Avrupa","Suşi, Avrupa, Uluslararası",667,+90 212 227 44 04,177-709,4.0,"Vejetaryen Dostu, Vegan Seçenekleri, Glütensiz Seçenekler",443.0,443.0
Parole,"İstiklal Caddesi Suriye Pasajı No:166/C, İstanbul Türkiye,İnternet sitesi,Menü","Bar,Akdeniz,Avrupa","Vejetaryen Dostu, Vegan Seçenekleri, Helal, Glütensiz Seçenekler",357,+90 212 245 01 23,,4.0,"Kahvaltı, Öğle Yemeği, Akşam Yemeği, Brunch, Gece Eğlencesi, İçecekler",443.0,443.0
Vapiano,"bagdat caddesi, İstanbul 34000 Türkiye,İnternet sitesi","İtalyan,Pizza,Akdeniz","İtalyan, Pizza, Avrupa, Akdeniz",346,+90 216 464 42 65,177-709,4.0,"Vejetaryen Dostu, Vegan Seçenekleri",443.0,443.0
Mürver Restaurant,"Kemankeş Caddesi No: 57-59 Karaköy, Beyoğlu, İstanbul 34425 Türkiye,İnternet sitesi,Menü","Deniz Mahsülleri,Akdeniz,Barbekü","Vejetaryen Dostu, Vegan Seçenekleri, Glütensiz Seçenekler",288,+90 212 372 07 50,,4.0,"Akşam Yemeği, İçecekler",443.0,443.0
Köşebaşı Galleria,"Bakırköy Sahil Yolu Galleria Alışveriş Merkezi Ataköy, Bakırköy, İstanbul Türkiye,İnternet sitesi","Barbekü,Türk,Helal",Helal,164,+90 212 560 98 88,,4.0,"Öğle Yemeği, Akşam Yemeği",443.0,443.0
Pierre Loti Tepesi Tesisleri,"Merkez Mah. Idris Kosku Cad. No:4 Eyup Merkez, Eyup, İstanbul Türkiye,İnternet sitesi","Kafe,Türk,Helal",Helal,76,4971313,,4.0,"Kahvaltı, Öğle Yemeği",443.0,443.0
